-- phpMyAdmin SQL Dump
-- version 4.9.2
-- https://www.phpmyadmin.net/
--
-- Host: 127.0.0.1:3306
-- Generation Time: Jan 17, 2021 at 05:53 PM
-- Server version: 10.4.10-MariaDB
-- PHP Version: 7.3.12

SET SQL_MODE = "NO_AUTO_VALUE_ON_ZERO";
SET AUTOCOMMIT = 0;
START TRANSACTION;
SET time_zone = "+00:00";


/*!40101 SET @OLD_CHARACTER_SET_CLIENT=@@CHARACTER_SET_CLIENT */;
/*!40101 SET @OLD_CHARACTER_SET_RESULTS=@@CHARACTER_SET_RESULTS */;
/*!40101 SET @OLD_COLLATION_CONNECTION=@@COLLATION_CONNECTION */;
/*!40101 SET NAMES utf8mb4 */;

--
-- Database: `todz`
--

-- --------------------------------------------------------

--
-- Table structure for table `admins`
--

DROP TABLE IF EXISTS `admins`;
CREATE TABLE IF NOT EXISTS `admins` (
  `id` bigint(20) UNSIGNED NOT NULL AUTO_INCREMENT,
  `first_name` varchar(191) COLLATE utf8mb4_unicode_ci NOT NULL,
  `last_name` varchar(191) COLLATE utf8mb4_unicode_ci NOT NULL,
  `email` varchar(191) COLLATE utf8mb4_unicode_ci NOT NULL,
  `email_verified_at` timestamp NULL DEFAULT NULL,
  `password` varchar(191) COLLATE utf8mb4_unicode_ci NOT NULL,
  `phone_code` varchar(191) COLLATE utf8mb4_unicode_ci NOT NULL,
  `phone_number` varchar(191) COLLATE utf8mb4_unicode_ci NOT NULL,
  `is_super` int(11) NOT NULL DEFAULT 0,
  `account_status` int(11) NOT NULL DEFAULT 1,
  `remember_token` varchar(100) COLLATE utf8mb4_unicode_ci DEFAULT NULL,
  `created_at` timestamp NULL DEFAULT NULL,
  `updated_at` timestamp NULL DEFAULT NULL,
  PRIMARY KEY (`id`),
  UNIQUE KEY `admins_email_unique` (`email`)
) ENGINE=InnoDB AUTO_INCREMENT=4 DEFAULT CHARSET=utf8mb4 COLLATE=utf8mb4_unicode_ci;

--
-- Dumping data for table `admins`
--

INSERT INTO `admins` (`id`, `first_name`, `last_name`, `email`, `email_verified_at`, `password`, `phone_code`, `phone_number`, `is_super`, `account_status`, `remember_token`, `created_at`, `updated_at`) VALUES
(1, 'Admin', 'User', 'admin@gmail.com', NULL, '$2y$10$yi3dah2foR1G8Vmb8wp53Osptmf9Hj6.rcQ6MTYIT3i7YTEALJU8y', '91', '9646367199', 1, 1, NULL, '2020-07-02 04:33:22', '2020-07-10 06:51:34');

-- --------------------------------------------------------

--
-- Table structure for table `admin_comission`
--

DROP TABLE IF EXISTS `admin_comission`;
CREATE TABLE IF NOT EXISTS `admin_comission` (
  `id` bigint(20) UNSIGNED NOT NULL AUTO_INCREMENT,
  `project_comission` int(11) NOT NULL DEFAULT 0,
  `created_at` timestamp NULL DEFAULT NULL,
  `updated_at` timestamp NULL DEFAULT NULL,
  `vat` double(8,2) NOT NULL DEFAULT 0.00,
  `payment_gateway_fee` double(8,2) NOT NULL DEFAULT 0.00,
  `vat_number` varchar(191) COLLATE utf8mb4_unicode_ci DEFAULT NULL,
  PRIMARY KEY (`id`)
) ENGINE=InnoDB AUTO_INCREMENT=2 DEFAULT CHARSET=utf8mb4 COLLATE=utf8mb4_unicode_ci;

--
-- Dumping data for table `admin_comission`
--

INSERT INTO `admin_comission` (`id`, `project_comission`, `created_at`, `updated_at`, `vat`, `payment_gateway_fee`, `vat_number`) VALUES
(1, 17, '2020-06-23 18:30:00', '2020-07-01 07:29:08', 2.00, 10.10, '234324234');

-- --------------------------------------------------------

--
-- Table structure for table `admin_revenues`
--

DROP TABLE IF EXISTS `admin_revenues`;
CREATE TABLE IF NOT EXISTS `admin_revenues` (
  `id` bigint(20) UNSIGNED NOT NULL AUTO_INCREMENT,
  `project_id` bigint(20) UNSIGNED NOT NULL DEFAULT 0,
  `from_user_id` bigint(20) UNSIGNED NOT NULL DEFAULT 0,
  `amount` varchar(191) COLLATE utf8mb4_unicode_ci NOT NULL DEFAULT '0',
  `transaction_id` varchar(191) COLLATE utf8mb4_unicode_ci DEFAULT NULL,
  `transaction_response` text COLLATE utf8mb4_unicode_ci DEFAULT NULL,
  `commission_from` varchar(191) COLLATE utf8mb4_unicode_ci DEFAULT NULL,
  `created_at` timestamp NULL DEFAULT NULL,
  `updated_at` timestamp NULL DEFAULT NULL,
  PRIMARY KEY (`id`)
) ENGINE=InnoDB AUTO_INCREMENT=29 DEFAULT CHARSET=utf8mb4 COLLATE=utf8mb4_unicode_ci;

--
-- Dumping data for table `admin_revenues`
--

INSERT INTO `admin_revenues` (`id`, `project_id`, `from_user_id`, `amount`, `transaction_id`, `transaction_response`, `commission_from`, `created_at`, `updated_at`) VALUES
(1, 113, 64, '6', '82352884', '{\"Id\":\"82352884\",\"Tag\":null,\"CreationDate\":1592735231,\"AuthorId\":\"80636648\",\"CreditedUserId\":\"81694917\",\"DebitedFunds\":{\"Currency\":\"USD\",\"Amount\":600},\"CreditedFunds\":{\"Currency\":\"USD\",\"Amount\":600},\"Fees\":{\"Currency\":\"USD\",\"Amount\":0},\"Status\":\"SUCCEEDED\",\"ResultCode\":\"000000\",\"ResultMessage\":\"Success\",\"ExecutionDate\":1592735231,\"Type\":\"TRANSFER\",\"Nature\":\"REGULAR\",\"DebitedWalletId\":\"80636649\",\"CreditedWalletId\":\"81694921\"}', 'client', '2020-06-21 04:57:12', '2020-06-21 04:57:12'),
(2, 87, 64, '250', '82356600', '{\"Id\":\"82356600\",\"Tag\":null,\"CreationDate\":1592744494,\"AuthorId\":\"80636648\",\"CreditedUserId\":\"81694917\",\"DebitedFunds\":{\"Currency\":\"USD\",\"Amount\":25000},\"CreditedFunds\":{\"Currency\":\"USD\",\"Amount\":25000},\"Fees\":{\"Currency\":\"USD\",\"Amount\":0},\"Status\":\"SUCCEEDED\",\"ResultCode\":\"000000\",\"ResultMessage\":\"Success\",\"ExecutionDate\":1592744494,\"Type\":\"TRANSFER\",\"Nature\":\"REGULAR\",\"DebitedWalletId\":\"80636649\",\"CreditedWalletId\":\"81694921\"}', 'client', '2020-06-21 07:31:34', '2020-06-21 07:31:34'),
(3, 113, 69, '6', '82356634', '{\"Id\":\"82356634\",\"Tag\":null,\"CreationDate\":1592744712,\"AuthorId\":\"80636648\",\"CreditedUserId\":\"81694917\",\"DebitedFunds\":{\"Currency\":\"USD\",\"Amount\":600},\"CreditedFunds\":{\"Currency\":\"USD\",\"Amount\":600},\"Fees\":{\"Currency\":\"USD\",\"Amount\":0},\"Status\":\"SUCCEEDED\",\"ResultCode\":\"000000\",\"ResultMessage\":\"Success\",\"ExecutionDate\":1592744712,\"Type\":\"TRANSFER\",\"Nature\":\"REGULAR\",\"DebitedWalletId\":\"80636649\",\"CreditedWalletId\":\"81694921\"}', 'talent', '2020-06-21 07:35:12', '2020-06-21 07:35:12'),
(4, 114, 64, '6', '82395874', '{\"Id\":\"82395874\",\"Tag\":null,\"CreationDate\":1592821356,\"AuthorId\":\"80636648\",\"CreditedUserId\":\"81694917\",\"DebitedFunds\":{\"Currency\":\"USD\",\"Amount\":600},\"CreditedFunds\":{\"Currency\":\"USD\",\"Amount\":600},\"Fees\":{\"Currency\":\"USD\",\"Amount\":0},\"Status\":\"SUCCEEDED\",\"ResultCode\":\"000000\",\"ResultMessage\":\"Success\",\"ExecutionDate\":1592821356,\"Type\":\"TRANSFER\",\"Nature\":\"REGULAR\",\"DebitedWalletId\":\"80636649\",\"CreditedWalletId\":\"81694921\"}', 'client', '2020-06-22 04:52:37', '2020-06-22 04:52:37'),
(5, 114, 64, '6', '82396079', '{\"Id\":\"82396079\",\"Tag\":null,\"CreationDate\":1592821496,\"AuthorId\":\"80636648\",\"CreditedUserId\":\"81694917\",\"DebitedFunds\":{\"Currency\":\"USD\",\"Amount\":600},\"CreditedFunds\":{\"Currency\":\"USD\",\"Amount\":600},\"Fees\":{\"Currency\":\"USD\",\"Amount\":0},\"Status\":\"SUCCEEDED\",\"ResultCode\":\"000000\",\"ResultMessage\":\"Success\",\"ExecutionDate\":1592821496,\"Type\":\"TRANSFER\",\"Nature\":\"REGULAR\",\"DebitedWalletId\":\"80636649\",\"CreditedWalletId\":\"81694921\"}', 'talent', '2020-06-22 04:54:57', '2020-06-22 04:54:57'),
(6, 115, 64, '1.5', '82403710', '{\"Id\":\"82403710\",\"Tag\":null,\"CreationDate\":1592826377,\"AuthorId\":\"80636648\",\"CreditedUserId\":\"81694917\",\"DebitedFunds\":{\"Currency\":\"USD\",\"Amount\":150},\"CreditedFunds\":{\"Currency\":\"USD\",\"Amount\":150},\"Fees\":{\"Currency\":\"USD\",\"Amount\":0},\"Status\":\"SUCCEEDED\",\"ResultCode\":\"000000\",\"ResultMessage\":\"Success\",\"ExecutionDate\":1592826377,\"Type\":\"TRANSFER\",\"Nature\":\"REGULAR\",\"DebitedWalletId\":\"80636649\",\"CreditedWalletId\":\"81694921\"}', 'client', '2020-06-22 06:16:17', '2020-06-22 06:16:17'),
(7, 115, 64, '3', '82404626', '{\"Id\":\"82404626\",\"Tag\":null,\"CreationDate\":1592826964,\"AuthorId\":\"80636648\",\"CreditedUserId\":\"81694917\",\"DebitedFunds\":{\"Currency\":\"USD\",\"Amount\":300},\"CreditedFunds\":{\"Currency\":\"USD\",\"Amount\":300},\"Fees\":{\"Currency\":\"USD\",\"Amount\":0},\"Status\":\"SUCCEEDED\",\"ResultCode\":\"000000\",\"ResultMessage\":\"Success\",\"ExecutionDate\":1592826964,\"Type\":\"TRANSFER\",\"Nature\":\"REGULAR\",\"DebitedWalletId\":\"80636649\",\"CreditedWalletId\":\"81694921\"}', 'talent', '2020-06-22 06:26:05', '2020-06-22 06:26:05'),
(8, 110, 74, '3', '82568605', '{\"Id\":\"82568605\",\"Tag\":null,\"CreationDate\":1593001776,\"AuthorId\":\"80696404\",\"CreditedUserId\":\"81694917\",\"DebitedFunds\":{\"Currency\":\"USD\",\"Amount\":300},\"CreditedFunds\":{\"Currency\":\"USD\",\"Amount\":300},\"Fees\":{\"Currency\":\"USD\",\"Amount\":0},\"Status\":\"SUCCEEDED\",\"ResultCode\":\"000000\",\"ResultMessage\":\"Success\",\"ExecutionDate\":1593001776,\"Type\":\"TRANSFER\",\"Nature\":\"REGULAR\",\"DebitedWalletId\":\"80696405\",\"CreditedWalletId\":\"81694921\"}', 'client', '2020-06-24 06:59:36', '2020-06-24 06:59:36'),
(9, 110, 74, '3', '82569544', '{\"Id\":\"82569544\",\"Tag\":null,\"CreationDate\":1593002420,\"AuthorId\":\"80696404\",\"CreditedUserId\":\"81694917\",\"DebitedFunds\":{\"Currency\":\"USD\",\"Amount\":300},\"CreditedFunds\":{\"Currency\":\"USD\",\"Amount\":300},\"Fees\":{\"Currency\":\"USD\",\"Amount\":0},\"Status\":\"SUCCEEDED\",\"ResultCode\":\"000000\",\"ResultMessage\":\"Success\",\"ExecutionDate\":1593002420,\"Type\":\"TRANSFER\",\"Nature\":\"REGULAR\",\"DebitedWalletId\":\"80696405\",\"CreditedWalletId\":\"81694921\"}', 'talent', '2020-06-24 07:10:20', '2020-06-24 07:10:20'),
(10, 116, 74, '5.1', '82583613', '{\"Id\":\"82583613\",\"Tag\":null,\"CreationDate\":1593012298,\"AuthorId\":\"80696404\",\"CreditedUserId\":\"81694917\",\"DebitedFunds\":{\"Currency\":\"USD\",\"Amount\":510},\"CreditedFunds\":{\"Currency\":\"USD\",\"Amount\":510},\"Fees\":{\"Currency\":\"USD\",\"Amount\":0},\"Status\":\"SUCCEEDED\",\"ResultCode\":\"000000\",\"ResultMessage\":\"Success\",\"ExecutionDate\":1593012298,\"Type\":\"TRANSFER\",\"Nature\":\"REGULAR\",\"DebitedWalletId\":\"80696405\",\"CreditedWalletId\":\"81694921\"}', 'client', '2020-06-24 09:54:59', '2020-06-24 09:54:59'),
(11, 116, 74, '5.1', '82583738', '{\"Id\":\"82583738\",\"Tag\":null,\"CreationDate\":1593012383,\"AuthorId\":\"80696404\",\"CreditedUserId\":\"81694917\",\"DebitedFunds\":{\"Currency\":\"USD\",\"Amount\":510},\"CreditedFunds\":{\"Currency\":\"USD\",\"Amount\":510},\"Fees\":{\"Currency\":\"USD\",\"Amount\":0},\"Status\":\"SUCCEEDED\",\"ResultCode\":\"000000\",\"ResultMessage\":\"Success\",\"ExecutionDate\":1593012383,\"Type\":\"TRANSFER\",\"Nature\":\"REGULAR\",\"DebitedWalletId\":\"80696405\",\"CreditedWalletId\":\"81694921\"}', 'client', '2020-06-24 09:56:23', '2020-06-24 09:56:23'),
(12, 109, 74, '5.1', '82615258', '{\"Id\":\"82615258\",\"Tag\":null,\"CreationDate\":1593070855,\"AuthorId\":\"80696404\",\"CreditedUserId\":\"81694917\",\"DebitedFunds\":{\"Currency\":\"USD\",\"Amount\":510},\"CreditedFunds\":{\"Currency\":\"USD\",\"Amount\":510},\"Fees\":{\"Currency\":\"USD\",\"Amount\":0},\"Status\":\"SUCCEEDED\",\"ResultCode\":\"000000\",\"ResultMessage\":\"Success\",\"ExecutionDate\":1593070855,\"Type\":\"TRANSFER\",\"Nature\":\"REGULAR\",\"DebitedWalletId\":\"80696405\",\"CreditedWalletId\":\"81694921\"}', 'client', '2020-06-25 02:10:55', '2020-06-25 02:10:55'),
(13, 118, 74, '17', '82718365', '{\"Id\":\"82718365\",\"Tag\":null,\"CreationDate\":1593170681,\"AuthorId\":\"80696404\",\"CreditedUserId\":\"81694917\",\"DebitedFunds\":{\"Currency\":\"USD\",\"Amount\":1700},\"CreditedFunds\":{\"Currency\":\"USD\",\"Amount\":1700},\"Fees\":{\"Currency\":\"USD\",\"Amount\":0},\"Status\":\"SUCCEEDED\",\"ResultCode\":\"000000\",\"ResultMessage\":\"Success\",\"ExecutionDate\":1593170681,\"Type\":\"TRANSFER\",\"Nature\":\"REGULAR\",\"DebitedWalletId\":\"80696405\",\"CreditedWalletId\":\"81694921\"}', 'client', '2020-06-26 05:54:42', '2020-06-26 05:54:42'),
(16, 117, 74, '17', '83204607', '{\"Id\":\"83204607\",\"Tag\":null,\"CreationDate\":1593762851,\"AuthorId\":\"80696404\",\"CreditedUserId\":\"81694917\",\"DebitedFunds\":{\"Currency\":\"USD\",\"Amount\":1700},\"CreditedFunds\":{\"Currency\":\"USD\",\"Amount\":1700},\"Fees\":{\"Currency\":\"USD\",\"Amount\":0},\"Status\":\"SUCCEEDED\",\"ResultCode\":\"000000\",\"ResultMessage\":\"Success\",\"ExecutionDate\":1593762851,\"Type\":\"TRANSFER\",\"Nature\":\"REGULAR\",\"DebitedWalletId\":\"80696405\",\"CreditedWalletId\":\"81694921\"}', 'client', '2020-07-03 02:24:13', '2020-07-03 02:24:13'),
(17, 108, 74, '6.8', '83247542', '{\"Id\":\"83247542\",\"Tag\":null,\"CreationDate\":1593787048,\"AuthorId\":\"80696404\",\"CreditedUserId\":\"81694917\",\"DebitedFunds\":{\"Currency\":\"USD\",\"Amount\":680},\"CreditedFunds\":{\"Currency\":\"USD\",\"Amount\":680},\"Fees\":{\"Currency\":\"USD\",\"Amount\":0},\"Status\":\"SUCCEEDED\",\"ResultCode\":\"000000\",\"ResultMessage\":\"Success\",\"ExecutionDate\":1593787048,\"Type\":\"TRANSFER\",\"Nature\":\"REGULAR\",\"DebitedWalletId\":\"80696405\",\"CreditedWalletId\":\"81694921\"}', 'client', '2020-07-03 09:07:30', '2020-07-03 09:07:30'),
(19, 105, 74, '56.1', '83248265', '{\"Id\":\"83248265\",\"Tag\":null,\"CreationDate\":1593787289,\"AuthorId\":\"80696404\",\"CreditedUserId\":\"81694917\",\"DebitedFunds\":{\"Currency\":\"USD\",\"Amount\":5610},\"CreditedFunds\":{\"Currency\":\"USD\",\"Amount\":5610},\"Fees\":{\"Currency\":\"USD\",\"Amount\":0},\"Status\":\"SUCCEEDED\",\"ResultCode\":\"000000\",\"ResultMessage\":\"Success\",\"ExecutionDate\":1593787289,\"Type\":\"TRANSFER\",\"Nature\":\"REGULAR\",\"DebitedWalletId\":\"80696405\",\"CreditedWalletId\":\"81694921\"}', 'client', '2020-07-03 09:11:30', '2020-07-03 09:11:30'),
(22, 119, 74, '6.8', '83258703', '{\"Id\":\"83258703\",\"Tag\":null,\"CreationDate\":1593797185,\"AuthorId\":\"80696404\",\"CreditedUserId\":\"81694917\",\"DebitedFunds\":{\"Currency\":\"USD\",\"Amount\":680},\"CreditedFunds\":{\"Currency\":\"USD\",\"Amount\":680},\"Fees\":{\"Currency\":\"USD\",\"Amount\":0},\"Status\":\"SUCCEEDED\",\"ResultCode\":\"000000\",\"ResultMessage\":\"Success\",\"ExecutionDate\":1593797185,\"Type\":\"TRANSFER\",\"Nature\":\"REGULAR\",\"DebitedWalletId\":\"80696405\",\"CreditedWalletId\":\"81694921\"}', 'client', '2020-07-03 11:56:27', '2020-07-03 11:56:27'),
(23, 119, 74, '6.8', '83258715', '{\"Id\":\"83258715\",\"Tag\":null,\"CreationDate\":1593797240,\"AuthorId\":\"80696404\",\"CreditedUserId\":\"81694917\",\"DebitedFunds\":{\"Currency\":\"USD\",\"Amount\":680},\"CreditedFunds\":{\"Currency\":\"USD\",\"Amount\":680},\"Fees\":{\"Currency\":\"USD\",\"Amount\":0},\"Status\":\"SUCCEEDED\",\"ResultCode\":\"000000\",\"ResultMessage\":\"Success\",\"ExecutionDate\":1593797241,\"Type\":\"TRANSFER\",\"Nature\":\"REGULAR\",\"DebitedWalletId\":\"80696405\",\"CreditedWalletId\":\"81694921\"}', 'client', '2020-07-03 11:57:22', '2020-07-03 11:57:22'),
(24, 119, 74, '6.8', '83258997', '{\"Id\":\"83258997\",\"Tag\":null,\"CreationDate\":1593797515,\"AuthorId\":\"80696404\",\"CreditedUserId\":\"81694917\",\"DebitedFunds\":{\"Currency\":\"USD\",\"Amount\":680},\"CreditedFunds\":{\"Currency\":\"USD\",\"Amount\":680},\"Fees\":{\"Currency\":\"USD\",\"Amount\":0},\"Status\":\"SUCCEEDED\",\"ResultCode\":\"000000\",\"ResultMessage\":\"Success\",\"ExecutionDate\":1593797515,\"Type\":\"TRANSFER\",\"Nature\":\"REGULAR\",\"DebitedWalletId\":\"80696405\",\"CreditedWalletId\":\"81694921\"}', 'client', '2020-07-03 12:01:57', '2020-07-03 12:01:57'),
(26, 119, 74, '3.4', '83259120', '{\"Id\":\"83259120\",\"Tag\":null,\"CreationDate\":1593797622,\"AuthorId\":\"80696404\",\"CreditedUserId\":\"81694917\",\"DebitedFunds\":{\"Currency\":\"USD\",\"Amount\":340},\"CreditedFunds\":{\"Currency\":\"USD\",\"Amount\":340},\"Fees\":{\"Currency\":\"USD\",\"Amount\":0},\"Status\":\"SUCCEEDED\",\"ResultCode\":\"000000\",\"ResultMessage\":\"Success\",\"ExecutionDate\":1593797622,\"Type\":\"TRANSFER\",\"Nature\":\"REGULAR\",\"DebitedWalletId\":\"80696405\",\"CreditedWalletId\":\"81694921\"}', 'talent', '2020-07-03 12:03:43', '2020-07-03 12:03:43'),
(27, 119, 74, '3.4', '83259522', '{\"Id\":\"83259522\",\"Tag\":null,\"CreationDate\":1593798325,\"AuthorId\":\"80696404\",\"CreditedUserId\":\"81694917\",\"DebitedFunds\":{\"Currency\":\"USD\",\"Amount\":340},\"CreditedFunds\":{\"Currency\":\"USD\",\"Amount\":340},\"Fees\":{\"Currency\":\"USD\",\"Amount\":0},\"Status\":\"SUCCEEDED\",\"ResultCode\":\"000000\",\"ResultMessage\":\"Success\",\"ExecutionDate\":1593798325,\"Type\":\"TRANSFER\",\"Nature\":\"REGULAR\",\"DebitedWalletId\":\"80696405\",\"CreditedWalletId\":\"81694921\"}', 'talent', '2020-07-03 12:15:26', '2020-07-03 12:15:26'),
(28, 119, 74, '6.8', '83260980', '{\"Id\":\"83260980\",\"Tag\":null,\"CreationDate\":1593802434,\"AuthorId\":\"80696404\",\"CreditedUserId\":\"81694917\",\"DebitedFunds\":{\"Currency\":\"USD\",\"Amount\":680},\"CreditedFunds\":{\"Currency\":\"USD\",\"Amount\":680},\"Fees\":{\"Currency\":\"USD\",\"Amount\":0},\"Status\":\"SUCCEEDED\",\"ResultCode\":\"000000\",\"ResultMessage\":\"Success\",\"ExecutionDate\":1593802434,\"Type\":\"TRANSFER\",\"Nature\":\"REGULAR\",\"DebitedWalletId\":\"80696405\",\"CreditedWalletId\":\"81694921\"}', 'talent', '2020-07-03 13:23:56', '2020-07-03 13:23:56');

-- --------------------------------------------------------

--
-- Table structure for table `apps_countries`
--

DROP TABLE IF EXISTS `apps_countries`;
CREATE TABLE IF NOT EXISTS `apps_countries` (
  `id` int(11) NOT NULL AUTO_INCREMENT,
  `country_code` varchar(2) NOT NULL DEFAULT '',
  `country_name` varchar(100) NOT NULL DEFAULT '',
  PRIMARY KEY (`id`)
) ENGINE=MyISAM AUTO_INCREMENT=247 DEFAULT CHARSET=utf8;

--
-- Dumping data for table `apps_countries`
--

INSERT INTO `apps_countries` (`id`, `country_code`, `country_name`) VALUES
(1, 'AF', 'Afghanistan'),
(2, 'AL', 'Albania'),
(3, 'DZ', 'Algeria'),
(4, 'DS', 'American Samoa'),
(5, 'AD', 'Andorra'),
(6, 'AO', 'Angola'),
(7, 'AI', 'Anguilla'),
(8, 'AQ', 'Antarctica'),
(9, 'AG', 'Antigua and Barbuda'),
(10, 'AR', 'Argentina'),
(11, 'AM', 'Armenia'),
(12, 'AW', 'Aruba'),
(13, 'AU', 'Australia'),
(14, 'AT', 'Austria'),
(15, 'AZ', 'Azerbaijan'),
(16, 'BS', 'Bahamas'),
(17, 'BH', 'Bahrain'),
(18, 'BD', 'Bangladesh'),
(19, 'BB', 'Barbados'),
(20, 'BY', 'Belarus'),
(21, 'BE', 'Belgium'),
(22, 'BZ', 'Belize'),
(23, 'BJ', 'Benin'),
(24, 'BM', 'Bermuda'),
(25, 'BT', 'Bhutan'),
(26, 'BO', 'Bolivia'),
(27, 'BA', 'Bosnia and Herzegovina'),
(28, 'BW', 'Botswana'),
(29, 'BV', 'Bouvet Island'),
(30, 'BR', 'Brazil'),
(31, 'IO', 'British Indian Ocean Territory'),
(32, 'BN', 'Brunei Darussalam'),
(33, 'BG', 'Bulgaria'),
(34, 'BF', 'Burkina Faso'),
(35, 'BI', 'Burundi'),
(36, 'KH', 'Cambodia'),
(37, 'CM', 'Cameroon'),
(38, 'CA', 'Canada'),
(39, 'CV', 'Cape Verde'),
(40, 'KY', 'Cayman Islands'),
(41, 'CF', 'Central African Republic'),
(42, 'TD', 'Chad'),
(43, 'CL', 'Chile'),
(44, 'CN', 'China'),
(45, 'CX', 'Christmas Island'),
(46, 'CC', 'Cocos (Keeling) Islands'),
(47, 'CO', 'Colombia'),
(48, 'KM', 'Comoros'),
(49, 'CD', 'Democratic Republic of the Congo'),
(50, 'CG', 'Republic of Congo'),
(51, 'CK', 'Cook Islands'),
(52, 'CR', 'Costa Rica'),
(53, 'HR', 'Croatia (Hrvatska)'),
(54, 'CU', 'Cuba'),
(55, 'CY', 'Cyprus'),
(56, 'CZ', 'Czech Republic'),
(57, 'DK', 'Denmark'),
(58, 'DJ', 'Djibouti'),
(59, 'DM', 'Dominica'),
(60, 'DO', 'Dominican Republic'),
(61, 'TP', 'East Timor'),
(62, 'EC', 'Ecuador'),
(63, 'EG', 'Egypt'),
(64, 'SV', 'El Salvador'),
(65, 'GQ', 'Equatorial Guinea'),
(66, 'ER', 'Eritrea'),
(67, 'EE', 'Estonia'),
(68, 'ET', 'Ethiopia'),
(69, 'FK', 'Falkland Islands (Malvinas)'),
(70, 'FO', 'Faroe Islands'),
(71, 'FJ', 'Fiji'),
(72, 'FI', 'Finland'),
(73, 'FR', 'France'),
(74, 'FX', 'France, Metropolitan'),
(75, 'GF', 'French Guiana'),
(76, 'PF', 'French Polynesia'),
(77, 'TF', 'French Southern Territories'),
(78, 'GA', 'Gabon'),
(79, 'GM', 'Gambia'),
(80, 'GE', 'Georgia'),
(81, 'DE', 'Germany'),
(82, 'GH', 'Ghana'),
(83, 'GI', 'Gibraltar'),
(84, 'GK', 'Guernsey'),
(85, 'GR', 'Greece'),
(86, 'GL', 'Greenland'),
(87, 'GD', 'Grenada'),
(88, 'GP', 'Guadeloupe'),
(89, 'GU', 'Guam'),
(90, 'GT', 'Guatemala'),
(91, 'GN', 'Guinea'),
(92, 'GW', 'Guinea-Bissau'),
(93, 'GY', 'Guyana'),
(94, 'HT', 'Haiti'),
(95, 'HM', 'Heard and Mc Donald Islands'),
(96, 'HN', 'Honduras'),
(97, 'HK', 'Hong Kong'),
(98, 'HU', 'Hungary'),
(99, 'IS', 'Iceland'),
(100, 'IN', 'India'),
(101, 'IM', 'Isle of Man'),
(102, 'ID', 'Indonesia'),
(103, 'IR', 'Iran (Islamic Republic of)'),
(104, 'IQ', 'Iraq'),
(105, 'IE', 'Ireland'),
(106, 'IL', 'Israel'),
(107, 'IT', 'Italy'),
(108, 'CI', 'Ivory Coast'),
(109, 'JE', 'Jersey'),
(110, 'JM', 'Jamaica'),
(111, 'JP', 'Japan'),
(112, 'JO', 'Jordan'),
(113, 'KZ', 'Kazakhstan'),
(114, 'KE', 'Kenya'),
(115, 'KI', 'Kiribati'),
(116, 'KP', 'Korea, Democratic People\'s Republic of'),
(117, 'KR', 'Korea, Republic of'),
(118, 'XK', 'Kosovo'),
(119, 'KW', 'Kuwait'),
(120, 'KG', 'Kyrgyzstan'),
(121, 'LA', 'Lao People\'s Democratic Republic'),
(122, 'LV', 'Latvia'),
(123, 'LB', 'Lebanon'),
(124, 'LS', 'Lesotho'),
(125, 'LR', 'Liberia'),
(126, 'LY', 'Libyan Arab Jamahiriya'),
(127, 'LI', 'Liechtenstein'),
(128, 'LT', 'Lithuania'),
(129, 'LU', 'Luxembourg'),
(130, 'MO', 'Macau'),
(131, 'MK', 'North Macedonia'),
(132, 'MG', 'Madagascar'),
(133, 'MW', 'Malawi'),
(134, 'MY', 'Malaysia'),
(135, 'MV', 'Maldives'),
(136, 'ML', 'Mali'),
(137, 'MT', 'Malta'),
(138, 'MH', 'Marshall Islands'),
(139, 'MQ', 'Martinique'),
(140, 'MR', 'Mauritania'),
(141, 'MU', 'Mauritius'),
(142, 'TY', 'Mayotte'),
(143, 'MX', 'Mexico'),
(144, 'FM', 'Micronesia, Federated States of'),
(145, 'MD', 'Moldova, Republic of'),
(146, 'MC', 'Monaco'),
(147, 'MN', 'Mongolia'),
(148, 'ME', 'Montenegro'),
(149, 'MS', 'Montserrat'),
(150, 'MA', 'Morocco'),
(151, 'MZ', 'Mozambique'),
(152, 'MM', 'Myanmar'),
(153, 'NA', 'Namibia'),
(154, 'NR', 'Nauru'),
(155, 'NP', 'Nepal'),
(156, 'NL', 'Netherlands'),
(157, 'AN', 'Netherlands Antilles'),
(158, 'NC', 'New Caledonia'),
(159, 'NZ', 'New Zealand'),
(160, 'NI', 'Nicaragua'),
(161, 'NE', 'Niger'),
(162, 'NG', 'Nigeria'),
(163, 'NU', 'Niue'),
(164, 'NF', 'Norfolk Island'),
(165, 'MP', 'Northern Mariana Islands'),
(166, 'NO', 'Norway'),
(167, 'OM', 'Oman'),
(168, 'PK', 'Pakistan'),
(169, 'PW', 'Palau'),
(170, 'PS', 'Palestine'),
(171, 'PA', 'Panama'),
(172, 'PG', 'Papua New Guinea'),
(173, 'PY', 'Paraguay'),
(174, 'PE', 'Peru'),
(175, 'PH', 'Philippines'),
(176, 'PN', 'Pitcairn'),
(177, 'PL', 'Poland'),
(178, 'PT', 'Portugal'),
(179, 'PR', 'Puerto Rico'),
(180, 'QA', 'Qatar'),
(181, 'RE', 'Reunion'),
(182, 'RO', 'Romania'),
(183, 'RU', 'Russian Federation'),
(184, 'RW', 'Rwanda'),
(185, 'KN', 'Saint Kitts and Nevis'),
(186, 'LC', 'Saint Lucia'),
(187, 'VC', 'Saint Vincent and the Grenadines'),
(188, 'WS', 'Samoa'),
(189, 'SM', 'San Marino'),
(190, 'ST', 'Sao Tome and Principe'),
(191, 'SA', 'Saudi Arabia'),
(192, 'SN', 'Senegal'),
(193, 'RS', 'Serbia'),
(194, 'SC', 'Seychelles'),
(195, 'SL', 'Sierra Leone'),
(196, 'SG', 'Singapore'),
(197, 'SK', 'Slovakia'),
(198, 'SI', 'Slovenia'),
(199, 'SB', 'Solomon Islands'),
(200, 'SO', 'Somalia'),
(201, 'ZA', 'South Africa'),
(202, 'GS', 'South Georgia South Sandwich Islands'),
(203, 'SS', 'South Sudan'),
(204, 'ES', 'Spain'),
(205, 'LK', 'Sri Lanka'),
(206, 'SH', 'St. Helena'),
(207, 'PM', 'St. Pierre and Miquelon'),
(208, 'SD', 'Sudan'),
(209, 'SR', 'Suriname'),
(210, 'SJ', 'Svalbard and Jan Mayen Islands'),
(211, 'SZ', 'Swaziland'),
(212, 'SE', 'Sweden'),
(213, 'CH', 'Switzerland'),
(214, 'SY', 'Syrian Arab Republic'),
(215, 'TW', 'Taiwan'),
(216, 'TJ', 'Tajikistan'),
(217, 'TZ', 'Tanzania, United Republic of'),
(218, 'TH', 'Thailand'),
(219, 'TG', 'Togo'),
(220, 'TK', 'Tokelau'),
(221, 'TO', 'Tonga'),
(222, 'TT', 'Trinidad and Tobago'),
(223, 'TN', 'Tunisia'),
(224, 'TR', 'Turkey'),
(225, 'TM', 'Turkmenistan'),
(226, 'TC', 'Turks and Caicos Islands'),
(227, 'TV', 'Tuvalu'),
(228, 'UG', 'Uganda'),
(229, 'UA', 'Ukraine'),
(230, 'AE', 'United Arab Emirates'),
(231, 'GB', 'United Kingdom'),
(232, 'US', 'United States'),
(233, 'UM', 'United States minor outlying islands'),
(234, 'UY', 'Uruguay'),
(235, 'UZ', 'Uzbekistan'),
(236, 'VU', 'Vanuatu'),
(237, 'VA', 'Vatican City State'),
(238, 'VE', 'Venezuela'),
(239, 'VN', 'Vietnam'),
(240, 'VG', 'Virgin Islands (British)'),
(241, 'VI', 'Virgin Islands (U.S.)'),
(242, 'WF', 'Wallis and Futuna Islands'),
(243, 'EH', 'Western Sahara'),
(244, 'YE', 'Yemen'),
(245, 'ZM', 'Zambia'),
(246, 'ZW', 'Zimbabwe');

-- --------------------------------------------------------

--
-- Table structure for table `bank_accounts`
--

DROP TABLE IF EXISTS `bank_accounts`;
CREATE TABLE IF NOT EXISTS `bank_accounts` (
  `id` bigint(20) UNSIGNED NOT NULL AUTO_INCREMENT,
  `user_id` bigint(20) UNSIGNED NOT NULL,
  `mangopay_account_id` bigint(20) UNSIGNED NOT NULL,
  `is_default` varchar(191) COLLATE utf8mb4_unicode_ci NOT NULL DEFAULT '0',
  `bank_id` varchar(191) COLLATE utf8mb4_unicode_ci DEFAULT NULL,
  `response` text COLLATE utf8mb4_unicode_ci DEFAULT NULL,
  `created_at` timestamp NULL DEFAULT NULL,
  `updated_at` timestamp NULL DEFAULT NULL,
  `admin_id` bigint(20) UNSIGNED NOT NULL DEFAULT 0,
  PRIMARY KEY (`id`),
  KEY `bank_accounts_mangopay_account_id_foreign` (`mangopay_account_id`),
  KEY `bank_accounts_user_id_foreign` (`user_id`)
) ENGINE=InnoDB AUTO_INCREMENT=6 DEFAULT CHARSET=utf8mb4 COLLATE=utf8mb4_unicode_ci;

--
-- Dumping data for table `bank_accounts`
--

INSERT INTO `bank_accounts` (`id`, `user_id`, `mangopay_account_id`, `is_default`, `bank_id`, `response`, `created_at`, `updated_at`, `admin_id`) VALUES
(1, 4, 10, '0', '80337797', '{\"OwnerAddress\":{\"AddressLine1\":\"ldfjsalkfj\",\"AddressLine2\":\"lsdkfjlksfjl\",\"City\":\"mohali\",\"Region\":\"punjab\",\"PostalCode\":\"160059\",\"Country\":\"IN\"},\"AccountNumber\":\"11696419\",\"InstitutionNumber\":\"614\",\"BranchCode\":\"00152\",\"BankName\":\"The Big Bank\",\"UserId\":\"80024394\",\"OwnerName\":\"Rakashpal\",\"Type\":\"CA\",\"Id\":\"80337797\",\"Tag\":\"custom account\",\"CreationDate\":1589478103,\"Active\":true}', '2020-05-14 17:41:43', '2020-05-14 17:41:43', 0),
(2, 55, 16, '0', '80458358', '{\"OwnerAddress\":{\"AddressLine1\":\"dsfsdf\",\"AddressLine2\":\"fds\",\"City\":\"Hoshiarpur\",\"Region\":\"punjab\",\"PostalCode\":\"146113\",\"Country\":\"IN\"},\"AccountNumber\":\"11696419\",\"ABA\":\"071000288\",\"DepositAccountType\":\"CHECKING\",\"UserId\":\"80458219\",\"OwnerName\":\"jaspreet\",\"Type\":\"US\",\"Id\":\"80458358\",\"Tag\":\"abc\",\"CreationDate\":1589776389,\"Active\":true}', '2020-05-18 04:33:09', '2020-05-18 04:33:09', 0),
(3, 58, 20, '0', '80469485', '{\"OwnerAddress\":{\"AddressLine1\":\"Model Town\",\"AddressLine2\":\"Street 1\",\"City\":\"Hoshiarpur\",\"Region\":\"Punjab\",\"PostalCode\":\"146113\",\"Country\":\"IN\"},\"AccountNumber\":\"11696419\",\"ABA\":\"071000288\",\"DepositAccountType\":\"CHECKING\",\"UserId\":\"80468650\",\"OwnerName\":\"Jaspreet Kaur\",\"Type\":\"US\",\"Id\":\"80469485\",\"Tag\":\"abc\",\"CreationDate\":1589793328,\"Active\":true}', '2020-05-18 09:15:29', '2020-05-18 09:15:29', 0),
(4, 63, 22, '0', '80637231', '{\"OwnerAddress\":{\"AddressLine1\":\"Model Town\",\"AddressLine2\":\"Street 1\",\"City\":\"Hoshiarpur\",\"Region\":\"Punjab\",\"PostalCode\":\"146113\",\"Country\":\"IN\"},\"AccountNumber\":\"11696419\",\"ABA\":\"071000288\",\"DepositAccountType\":\"CHECKING\",\"UserId\":\"80636849\",\"OwnerName\":\"jacob\",\"Type\":\"US\",\"Id\":\"80637231\",\"Tag\":\"abc\",\"CreationDate\":1590046514,\"Active\":true}', '2020-05-21 07:35:14', '2020-05-21 07:35:14', 0),
(5, 98, 36, '0', '85459932', '{\"OwnerAddress\":{\"AddressLine1\":\"bnmbmnbm\",\"AddressLine2\":\"mnbmn\",\"City\":\"jhj\",\"Region\":\"nmb\",\"PostalCode\":\"76\",\"Country\":\"IN\"},\"AccountNumber\":\"23232323232323\",\"BIC\":\"8768768\",\"Country\":\"IN\",\"UserId\":\"85401722\",\"OwnerName\":\"xcxcx\",\"Type\":\"OTHER\",\"Id\":\"85459932\",\"Tag\":\"zxzx\",\"CreationDate\":1596692107,\"Active\":true}', '2020-08-06 00:05:09', '2020-08-06 00:05:09', 0);

-- --------------------------------------------------------

--
-- Table structure for table `bank_payouts`
--

DROP TABLE IF EXISTS `bank_payouts`;
CREATE TABLE IF NOT EXISTS `bank_payouts` (
  `id` bigint(20) UNSIGNED NOT NULL AUTO_INCREMENT,
  `user_id` bigint(20) UNSIGNED NOT NULL,
  `bank_account_id` bigint(20) UNSIGNED NOT NULL,
  `payout_id` varchar(191) COLLATE utf8mb4_unicode_ci NOT NULL,
  `amount` varchar(191) COLLATE utf8mb4_unicode_ci NOT NULL,
  `status` varchar(191) COLLATE utf8mb4_unicode_ci NOT NULL,
  `response` text COLLATE utf8mb4_unicode_ci NOT NULL,
  `created_at` timestamp NULL DEFAULT NULL,
  `updated_at` timestamp NULL DEFAULT NULL,
  `admin_id` bigint(20) UNSIGNED NOT NULL DEFAULT 0,
  PRIMARY KEY (`id`)
) ENGINE=InnoDB AUTO_INCREMENT=3 DEFAULT CHARSET=utf8mb4 COLLATE=utf8mb4_unicode_ci;

--
-- Dumping data for table `bank_payouts`
--

INSERT INTO `bank_payouts` (`id`, `user_id`, `bank_account_id`, `payout_id`, `amount`, `status`, `response`, `created_at`, `updated_at`, `admin_id`) VALUES
(1, 4, 1, '80430901', '800', 'CREATED', '{\"Id\":\"80430901\",\"Tag\":null,\"CreationDate\":1589687634,\"AuthorId\":\"80024394\",\"CreditedUserId\":null,\"DebitedFunds\":{\"Currency\":\"USD\",\"Amount\":80000},\"CreditedFunds\":{\"Currency\":\"USD\",\"Amount\":80000},\"Fees\":{\"Currency\":\"USD\",\"Amount\":0},\"Status\":\"CREATED\",\"ResultCode\":null,\"ResultMessage\":null,\"ExecutionDate\":null,\"Type\":\"PAYOUT\",\"Nature\":\"REGULAR\",\"CreditedWalletId\":null,\"DebitedWalletId\":\"80024395\",\"PaymentType\":\"BANK_WIRE\",\"BankAccountId\":\"80337797\",\"BankWireRef\":\"\"}', '2020-05-17 03:53:54', '2020-05-17 03:53:54', 0),
(2, 55, 2, '80458436', '750', 'CREATED', '{\"Id\":\"80458436\",\"Tag\":null,\"CreationDate\":1589776532,\"AuthorId\":\"80458219\",\"CreditedUserId\":null,\"DebitedFunds\":{\"Currency\":\"USD\",\"Amount\":75000},\"CreditedFunds\":{\"Currency\":\"USD\",\"Amount\":75000},\"Fees\":{\"Currency\":\"USD\",\"Amount\":0},\"Status\":\"CREATED\",\"ResultCode\":null,\"ResultMessage\":null,\"ExecutionDate\":null,\"Type\":\"PAYOUT\",\"Nature\":\"REGULAR\",\"CreditedWalletId\":null,\"DebitedWalletId\":\"80458220\",\"PaymentType\":\"BANK_WIRE\",\"BankAccountId\":\"80458358\",\"BankWireRef\":\"\"}', '2020-05-18 04:35:32', '2020-05-18 04:35:32', 0);

-- --------------------------------------------------------

--
-- Table structure for table `contacts`
--

DROP TABLE IF EXISTS `contacts`;
CREATE TABLE IF NOT EXISTS `contacts` (
  `id` bigint(20) UNSIGNED NOT NULL AUTO_INCREMENT,
  `name` varchar(191) COLLATE utf8mb4_unicode_ci NOT NULL,
  `email` varchar(191) COLLATE utf8mb4_unicode_ci NOT NULL,
  `purpose` varchar(191) COLLATE utf8mb4_unicode_ci NOT NULL,
  `message` varchar(191) COLLATE utf8mb4_unicode_ci NOT NULL,
  `status` int(11) NOT NULL DEFAULT 0,
  `created_at` timestamp NULL DEFAULT NULL,
  `updated_at` timestamp NULL DEFAULT NULL,
  PRIMARY KEY (`id`)
) ENGINE=InnoDB AUTO_INCREMENT=2 DEFAULT CHARSET=utf8mb4 COLLATE=utf8mb4_unicode_ci;

--
-- Dumping data for table `contacts`
--

INSERT INTO `contacts` (`id`, `name`, `email`, `purpose`, `message`, `status`, `created_at`, `updated_at`) VALUES
(1, 'ashish', 'aasdas@gmail.com', 'General Questions', 'asdas', 0, '2020-06-12 23:25:30', '2020-06-12 23:25:30');

-- --------------------------------------------------------

--
-- Table structure for table `coupons`
--

DROP TABLE IF EXISTS `coupons`;
CREATE TABLE IF NOT EXISTS `coupons` (
  `id` bigint(20) UNSIGNED NOT NULL AUTO_INCREMENT,
  `name` varchar(191) COLLATE utf8mb4_unicode_ci NOT NULL,
  `code` varchar(191) COLLATE utf8mb4_unicode_ci NOT NULL,
  `description` text COLLATE utf8mb4_unicode_ci DEFAULT NULL,
  `max_redemption` int(11) NOT NULL DEFAULT 1,
  `expire_date` varchar(191) COLLATE utf8mb4_unicode_ci DEFAULT NULL,
  `price` varchar(191) COLLATE utf8mb4_unicode_ci NOT NULL DEFAULT '0',
  `discount_type` varchar(191) COLLATE utf8mb4_unicode_ci NOT NULL DEFAULT '1' COMMENT '1=>per% 2=>flat',
  `created_at` timestamp NULL DEFAULT NULL,
  `updated_at` timestamp NULL DEFAULT NULL,
  `coupon_type` text COLLATE utf8mb4_unicode_ci NOT NULL,
  `coupon_value` text COLLATE utf8mb4_unicode_ci DEFAULT NULL,
  PRIMARY KEY (`id`)
) ENGINE=InnoDB AUTO_INCREMENT=2 DEFAULT CHARSET=utf8mb4 COLLATE=utf8mb4_unicode_ci;

--
-- Dumping data for table `coupons`
--

INSERT INTO `coupons` (`id`, `name`, `code`, `description`, `max_redemption`, `expire_date`, `price`, `discount_type`, `created_at`, `updated_at`, `coupon_type`, `coupon_value`) VALUES
(1, 'aaa', '5ECE152D462E9', 'hhhhh', 1, NULL, '0', '1', '2020-05-27 07:22:35', '2020-06-04 22:43:35', '3', '10');

-- --------------------------------------------------------

--
-- Table structure for table `escalations`
--

DROP TABLE IF EXISTS `escalations`;
CREATE TABLE IF NOT EXISTS `escalations` (
  `id` bigint(20) UNSIGNED NOT NULL AUTO_INCREMENT,
  `talent_id` int(11) NOT NULL DEFAULT 0,
  `project_id` int(11) NOT NULL DEFAULT 0,
  `milestone_id` int(11) NOT NULL DEFAULT 0,
  `owner_id` varchar(255) COLLATE utf8mb4_unicode_ci DEFAULT NULL,
  `comment` varchar(255) COLLATE utf8mb4_unicode_ci DEFAULT NULL,
  `status` int(11) NOT NULL DEFAULT 0,
  `created_at` timestamp NULL DEFAULT NULL,
  `updated_at` timestamp NULL DEFAULT NULL,
  `admin_comment` text COLLATE utf8mb4_unicode_ci DEFAULT NULL,
  `in_favour` text COLLATE utf8mb4_unicode_ci DEFAULT NULL,
  PRIMARY KEY (`id`)
) ENGINE=InnoDB AUTO_INCREMENT=9 DEFAULT CHARSET=utf8mb4 COLLATE=utf8mb4_unicode_ci;

--
-- Dumping data for table `escalations`
--

INSERT INTO `escalations` (`id`, `talent_id`, `project_id`, `milestone_id`, `owner_id`, `comment`, `status`, `created_at`, `updated_at`, `admin_comment`, `in_favour`) VALUES
(1, 63, 87, 45, '5EC627A32', 'issues', 0, '2020-05-30 08:35:17', '2020-05-30 08:35:17', NULL, NULL),
(2, 69, 106, 73, NULL, 'timer issue', 0, '2020-06-25 00:31:56', '2020-06-25 00:31:56', NULL, NULL),
(3, 69, 106, 73, NULL, 'testing issue', 0, '2020-06-25 00:36:46', '2020-06-25 00:36:46', NULL, NULL),
(4, 69, 106, 73, NULL, 'testing issue', 0, '2020-06-25 00:37:42', '2020-06-25 00:37:42', NULL, NULL),
(5, 98, 124, 87, NULL, 'some dummy description', 0, '2020-08-04 08:25:22', '2020-08-04 08:25:22', NULL, NULL),
(6, 98, 124, 87, NULL, 'some escalation', 0, '2020-08-04 23:07:36', '2020-08-04 23:07:36', NULL, NULL),
(7, 98, 124, 87, NULL, 'hjfds', 0, '2020-08-04 23:22:44', '2020-08-04 23:22:44', NULL, NULL),
(8, 98, 124, 87, NULL, 'jfjhvbnv', 0, '2020-08-04 23:25:01', '2020-08-04 23:25:01', NULL, NULL);

-- --------------------------------------------------------

--
-- Table structure for table `failed_jobs`
--

DROP TABLE IF EXISTS `failed_jobs`;
CREATE TABLE IF NOT EXISTS `failed_jobs` (
  `id` bigint(20) UNSIGNED NOT NULL AUTO_INCREMENT,
  `connection` text COLLATE utf8mb4_unicode_ci NOT NULL,
  `queue` text COLLATE utf8mb4_unicode_ci NOT NULL,
  `payload` longtext COLLATE utf8mb4_unicode_ci NOT NULL,
  `exception` longtext COLLATE utf8mb4_unicode_ci NOT NULL,
  `failed_at` timestamp NOT NULL DEFAULT current_timestamp(),
  PRIMARY KEY (`id`)
) ENGINE=InnoDB DEFAULT CHARSET=utf8mb4 COLLATE=utf8mb4_unicode_ci;

-- --------------------------------------------------------

--
-- Table structure for table `faqs`
--

DROP TABLE IF EXISTS `faqs`;
CREATE TABLE IF NOT EXISTS `faqs` (
  `id` bigint(20) UNSIGNED NOT NULL AUTO_INCREMENT,
  `title` varchar(191) COLLATE utf8mb4_unicode_ci NOT NULL,
  `content` longtext COLLATE utf8mb4_unicode_ci NOT NULL,
  `created_at` timestamp NULL DEFAULT NULL,
  `updated_at` timestamp NULL DEFAULT NULL,
  `category` varchar(191) COLLATE utf8mb4_unicode_ci NOT NULL,
  PRIMARY KEY (`id`)
) ENGINE=InnoDB AUTO_INCREMENT=7 DEFAULT CHARSET=utf8mb4 COLLATE=utf8mb4_unicode_ci;

--
-- Dumping data for table `faqs`
--

INSERT INTO `faqs` (`id`, `title`, `content`, `created_at`, `updated_at`, `category`) VALUES
(1, 'How do I sign up?', '<p>You will be asked to sign upfor free by using your LinkedIn or Facebook account. Please stay assured that tod-Z will not share your personal and contact information on your Profile page.</p>', '2020-07-27 23:29:59', '2020-07-27 23:31:22', 'Talent=> todder'),
(2, 'How do I receive a project?', '<p>When you have your Profile created after being accepted, you will be pitched by the project owners , they will discuss with you their project requirements and wait for an offer from your side indicating how much hours you will be able to accomplish their project within. Accordingly the Project owner will select the suitable talent for his project.</p>', '2020-07-27 23:32:01', '2020-07-27 23:32:01', 'Talent=> todder'),
(3, 'How do I check and change my account details?', '<p>Once you <a href=\"https://tod-z.com/talent/login\">log in</a>to your tod-Z account, you will be able to change your account information in the account settings.Please note that since your ID will be shown as anonymous, some personal details will not be allowed to change. Please be careful when you fill in your personal information in the beginning.</p>', '2020-07-27 23:32:41', '2020-07-27 23:32:41', 'Talent=> todder'),
(4, 'Why has my account  been suspended?', '<p>Here are a few reasons for accountssuspension:</p>\r\n\r\n<p>Themost likely reason for suspending a user&#39;s account:</p>\r\n\r\n<p>Posting personal contact information or links to contact information is related to violating&nbsp; Todder Terms and conditions. This is the most common reason for account suspension. Revealing your identity is by no means allowed on tod-Z.</p>\r\n\r\n<p>Please read&nbsp; ourTodder Terms and Conditions Carefully.</p>\r\n\r\n<p>If you have any further questions or want to discussyour account suspension, please contact us.</p>', '2020-07-27 23:33:28', '2020-07-27 23:33:28', 'Talent=> todder'),
(5, 'How to deactivate my account?', '<p>Meanwhile we don&rsquo;t have account deactivation option , however we are working on it and will be available on your account update soon.</p>', '2020-07-27 23:33:54', '2020-07-27 23:33:54', 'Talent=> todder'),
(6, 'How many assessments do I need to take?', '<p>You are required to clear 2 assessments after the profile screening.</p>\r\n\r\n<p>This involves a Cognitive assessment offered by our partner Bryq and technical test offered by ourpartner ExpertRating.Once you clear the assessments, there will be a final live personal interview and upon acceptance you will be able to be a todder on our platform and start receiving project pitches.</p>', '2020-07-27 23:38:03', '2020-07-27 23:38:03', 'Talent – Assessment:');

-- --------------------------------------------------------

--
-- Table structure for table `job_categories`
--

DROP TABLE IF EXISTS `job_categories`;
CREATE TABLE IF NOT EXISTS `job_categories` (
  `id` bigint(20) UNSIGNED NOT NULL AUTO_INCREMENT,
  `name` varchar(191) COLLATE utf8mb4_unicode_ci NOT NULL,
  `rank` varchar(191) COLLATE utf8mb4_unicode_ci NOT NULL DEFAULT '1',
  `created_at` timestamp NULL DEFAULT NULL,
  `updated_at` timestamp NULL DEFAULT NULL,
  PRIMARY KEY (`id`)
) ENGINE=InnoDB AUTO_INCREMENT=17 DEFAULT CHARSET=utf8mb4 COLLATE=utf8mb4_unicode_ci;

--
-- Dumping data for table `job_categories`
--

INSERT INTO `job_categories` (`id`, `name`, `rank`, `created_at`, `updated_at`) VALUES
(1, 'Content Writer Expert', '1', '2020-05-11 06:08:40', '2020-05-11 06:08:40'),
(2, 'Graphic Designer Expert', '1', '2020-05-11 06:08:40', '2020-05-11 06:08:40'),
(3, 'Web Designer UI & UX Expert', '1', '2020-05-11 06:08:40', '2020-05-11 06:08:40'),
(4, 'Web Developer Expert', '1', '2020-05-11 06:08:40', '2020-05-11 06:08:40'),
(5, 'Project Management Consultant', '1', '2020-05-11 06:08:40', '2020-05-11 06:08:40'),
(6, 'Legal Consultant', '1', '2020-05-11 06:08:40', '2020-05-11 06:08:40'),
(7, 'Data Entry Expert', '1', '2020-05-11 06:08:40', '2020-05-11 06:08:40'),
(8, 'HR Consultant', '1', '2020-05-11 06:08:40', '2020-05-11 06:08:40'),
(9, 'Business Development Strategist', '1', '2020-05-11 06:08:40', '2020-05-11 06:08:40'),
(10, 'Translator Expert', '1', '2020-05-11 06:08:40', '2020-05-11 06:08:40'),
(11, 'Operation Strategist', '1', '2020-05-11 06:08:40', '2020-05-11 06:08:40'),
(12, 'Digital Media Plan Strategist', '1', '2020-05-11 06:08:40', '2020-05-11 06:08:40'),
(13, 'App. Developer Expert', '1', '2020-05-11 06:08:40', '2020-05-11 06:08:40'),
(14, 'Research Consultant', '1', '2020-05-11 06:08:40', '2020-05-11 06:08:40'),
(15, 'Virtual Assistant Expert', '1', '2020-05-11 06:08:40', '2020-05-11 06:08:40'),
(16, 'Voice Over Expert', '1', '2020-05-11 06:08:40', '2020-05-11 06:08:40');

-- --------------------------------------------------------

--
-- Table structure for table `mangopay_accounts`
--

DROP TABLE IF EXISTS `mangopay_accounts`;
CREATE TABLE IF NOT EXISTS `mangopay_accounts` (
  `id` bigint(20) UNSIGNED NOT NULL AUTO_INCREMENT,
  `user_id` bigint(20) UNSIGNED NOT NULL,
  `mangopay_user_id` varchar(191) COLLATE utf8mb4_unicode_ci NOT NULL,
  `mangopay_wallet_id` varchar(191) COLLATE utf8mb4_unicode_ci NOT NULL,
  `created_at` timestamp NULL DEFAULT NULL,
  `updated_at` timestamp NULL DEFAULT NULL,
  `admin_id` bigint(20) UNSIGNED NOT NULL DEFAULT 0,
  PRIMARY KEY (`id`)
) ENGINE=InnoDB AUTO_INCREMENT=39 DEFAULT CHARSET=utf8mb4 COLLATE=utf8mb4_unicode_ci;

--
-- Dumping data for table `mangopay_accounts`
--

INSERT INTO `mangopay_accounts` (`id`, `user_id`, `mangopay_user_id`, `mangopay_wallet_id`, `created_at`, `updated_at`, `admin_id`) VALUES
(7, 9, '79968209', '79968210', '2020-05-07 05:59:20', '2020-05-07 05:59:20', 0),
(9, 10, '79968994', '79968995', '2020-05-07 06:12:27', '2020-05-07 06:12:27', 0),
(10, 4, '80024394', '80024395', '2020-05-08 06:48:22', '2020-05-08 06:48:22', 0),
(14, 45, '80230678', '80230679', '2020-05-13 04:10:26', '2020-05-13 04:10:26', 0),
(15, 56, '80263986', '80263989', '2020-05-13 14:13:49', '2020-05-13 14:13:49', 0),
(16, 55, '80458219', '80458220', '2020-05-18 04:28:44', '2020-05-18 04:28:44', 0),
(17, 59, '80464864', '80464865', '2020-05-18 08:21:35', '2020-05-18 08:21:35', 0),
(18, 30, '80465848', '80465849', '2020-05-18 08:36:54', '2020-05-18 08:36:54', 0),
(19, 57, '80467495', '80467496', '2020-05-18 09:00:59', '2020-05-18 09:00:59', 0),
(20, 58, '80468650', '80468651', '2020-05-18 09:06:01', '2020-05-18 09:06:01', 0),
(21, 64, '80636648', '80636649', '2020-05-21 07:13:28', '2020-05-21 07:13:28', 0),
(22, 63, '80636849', '80636850', '2020-05-21 07:20:35', '2020-05-21 07:20:35', 0),
(23, 69, '80677547', '80677548', '2020-05-22 06:39:23', '2020-05-22 06:39:23', 0),
(24, 72, '80688208', '80688209', '2020-05-22 10:25:41', '2020-05-22 10:25:41', 0),
(25, 65, '80689424', '80689425', '2020-05-22 10:41:37', '2020-05-22 10:41:37', 0),
(26, 71, '80690124', '80690125', '2020-05-22 10:52:44', '2020-05-22 10:52:44', 0),
(27, 74, '80696404', '80696405', '2020-05-22 12:38:36', '2020-05-22 12:38:36', 0),
(28, 73, '80696882', '80696883', '2020-05-22 12:46:24', '2020-05-22 12:46:24', 0),
(29, 1, '81694917', '81694921', '2020-06-10 05:44:09', '2020-06-10 05:44:09', 0),
(30, 1, '83121409', '83121412', '2020-07-02 05:57:14', '2020-07-02 05:57:14', 0),
(31, 1, '83121417', '83121418', '2020-07-02 05:57:18', '2020-07-02 05:57:18', 0),
(32, 1, '83121419', '83121421', '2020-07-02 05:57:21', '2020-07-02 05:57:21', 0),
(33, 1, '83121424', '83121425', '2020-07-02 05:57:23', '2020-07-02 05:57:23', 0),
(35, 0, '83123076', '83123077', '2020-07-02 06:07:33', '2020-07-02 06:07:33', 1),
(36, 98, '85401722', '85401727', '2020-08-05 03:50:04', '2020-08-05 03:50:04', 0),
(37, 93, '85461573', '85461574', '2020-08-06 00:41:27', '2020-08-06 00:41:27', 0),
(38, 111, '85658582', '85658583', '2020-08-10 08:08:26', '2020-08-10 08:08:26', 0);

-- --------------------------------------------------------

--
-- Table structure for table `messages`
--

DROP TABLE IF EXISTS `messages`;
CREATE TABLE IF NOT EXISTS `messages` (
  `id` bigint(20) UNSIGNED NOT NULL AUTO_INCREMENT,
  `to_id` bigint(20) UNSIGNED NOT NULL,
  `from_id` bigint(20) UNSIGNED NOT NULL,
  `project_id` bigint(20) UNSIGNED NOT NULL,
  `message` text COLLATE utf8mb4_unicode_ci DEFAULT NULL,
  `is_read` int(11) NOT NULL DEFAULT 0,
  `created_at` timestamp NULL DEFAULT NULL,
  `updated_at` timestamp NULL DEFAULT NULL,
  PRIMARY KEY (`id`)
) ENGINE=InnoDB AUTO_INCREMENT=116 DEFAULT CHARSET=utf8mb4 COLLATE=utf8mb4_unicode_ci;

--
-- Dumping data for table `messages`
--

INSERT INTO `messages` (`id`, `to_id`, `from_id`, `project_id`, `message`, `is_read`, `created_at`, `updated_at`) VALUES
(1, 3, 4, 1, 'Hi..dfssfasfsfsfsaf', 0, '2020-04-01 13:00:32', '2020-04-01 13:00:32'),
(2, 9, 4, 13, 'Hi', 0, '2020-04-01 13:08:22', '2020-04-01 13:08:22'),
(3, 9, 4, 13, 'How are you?', 0, '2020-04-01 13:08:47', '2020-04-01 13:08:47'),
(4, 4, 9, 13, 'I am good', 0, '2020-04-01 13:08:58', '2020-04-01 13:08:58'),
(5, 8, 9, 13, 'Hi', 0, '2020-04-01 13:58:38', '2020-04-01 13:58:38'),
(6, 9, 4, 13, 'Hi..', 0, '2020-04-02 05:30:22', '2020-04-02 05:30:22'),
(7, 3, 4, 1, 'Hello', 0, '2020-04-02 05:30:50', '2020-04-02 05:30:50'),
(8, 4, 3, 2, 'Hi..', 0, '2020-04-02 07:42:24', '2020-04-02 07:42:24'),
(9, 9, 4, 13, 'Hi', 0, '2020-04-02 09:21:25', '2020-04-02 09:21:25'),
(10, 4, 10, 15, 'hello', 0, '2020-04-03 11:00:05', '2020-04-03 11:00:05'),
(11, 4, 10, 15, 'Hope you are doing well on this project', 0, '2020-04-03 11:46:12', '2020-04-03 11:46:12'),
(12, 10, 4, 15, 'Ok', 0, '2020-04-03 13:37:45', '2020-04-03 13:37:45'),
(13, 10, 4, 15, 'how Are You?', 0, '2020-04-03 13:37:58', '2020-04-03 13:37:58'),
(14, 28, 10, 25, 'hi', 0, '2020-04-04 06:39:51', '2020-04-04 06:39:51'),
(15, 10, 28, 25, 'how are you?', 0, '2020-04-04 06:40:24', '2020-04-04 06:40:24'),
(16, 28, 10, 25, 'i am good', 0, '2020-04-04 06:44:57', '2020-04-04 06:44:57'),
(17, 10, 28, 25, 'goood', 0, '2020-04-04 06:45:29', '2020-04-04 06:45:29'),
(18, 10, 29, 26, 'Hello', 0, '2020-04-06 10:04:28', '2020-04-06 10:04:28'),
(19, 29, 10, 26, 'hiii', 0, '2020-04-06 10:04:56', '2020-04-06 10:04:56'),
(20, 10, 29, 26, 'How are you', 0, '2020-04-06 10:05:21', '2020-04-06 10:05:21'),
(21, 29, 10, 26, 'How is the work going', 0, '2020-04-06 10:09:12', '2020-04-06 10:09:12'),
(22, 3, 4, 1, 'Hello', 0, '2020-04-06 12:11:18', '2020-04-06 12:11:18'),
(23, 4, 3, 1, 'Hi...', 0, '2020-04-06 12:12:09', '2020-04-06 12:12:09'),
(24, 4, 3, 1, 'How are you?', 0, '2020-04-06 12:12:24', '2020-04-06 12:12:24'),
(25, 3, 4, 1, 'gfadfasffasfs', 0, '2020-04-06 12:13:47', '2020-04-06 12:13:47'),
(26, 4, 3, 1, 'fklsdfjasf ;lsfjas;f', 0, '2020-04-06 12:13:57', '2020-04-06 12:13:57'),
(27, 4, 3, 1, 'Hello sonfsdf', 0, '2020-04-06 12:17:06', '2020-04-06 12:17:06'),
(28, 3, 4, 1, 'fsdfasfasfasdf', 0, '2020-04-06 12:17:18', '2020-04-06 12:17:18'),
(29, 4, 3, 1, 'sdfasfdsafsfdfdas', 0, '2020-04-06 12:18:53', '2020-04-06 12:18:53'),
(30, 3, 4, 1, 'sdfsafsfsafsfdas', 0, '2020-04-06 12:19:00', '2020-04-06 12:19:00'),
(31, 4, 3, 1, 'Hi..', 0, '2020-04-06 12:32:35', '2020-04-06 12:32:35'),
(32, 4, 3, 1, 'Rakashpal Here', 0, '2020-04-06 12:32:42', '2020-04-06 12:32:42'),
(33, 3, 4, 1, 'hii', 0, '2020-04-06 12:33:51', '2020-04-06 12:33:51'),
(34, 4, 3, 1, 'Hi..', 0, '2020-04-06 12:34:16', '2020-04-06 12:34:16'),
(35, 4, 3, 1, 'How are you?', 0, '2020-04-06 12:34:28', '2020-04-06 12:34:28'),
(36, 4, 3, 1, 'Did you recieve message', 0, '2020-04-06 12:34:38', '2020-04-06 12:34:38'),
(37, 3, 4, 1, 'after refresh', 0, '2020-04-06 12:35:33', '2020-04-06 12:35:33'),
(38, 3, 4, 1, 'sdfdsfsdf', 0, '2020-04-06 12:36:05', '2020-04-06 12:36:05'),
(39, 3, 4, 1, 'sffdsfdsf', 0, '2020-04-06 12:36:08', '2020-04-06 12:36:08'),
(40, 3, 4, 1, 'Hello', 0, '2020-04-06 12:38:35', '2020-04-06 12:38:35'),
(41, 4, 3, 1, 'sfasdfasdfdas', 0, '2020-04-06 12:39:18', '2020-04-06 12:39:18'),
(42, 3, 4, 1, 'jfrdty', 0, '2020-04-06 12:39:25', '2020-04-06 12:39:25'),
(43, 4, 3, 1, 'Yeah', 0, '2020-04-06 12:39:33', '2020-04-06 12:39:33'),
(44, 3, 4, 1, 'jgjhgjfj', 0, '2020-04-06 12:39:35', '2020-04-06 12:39:35'),
(45, 3, 4, 1, 'yippppeeeee ballee balle', 0, '2020-04-06 12:39:49', '2020-04-06 12:39:49'),
(46, 4, 3, 1, 'Good', 0, '2020-04-06 12:39:49', '2020-04-06 12:39:49'),
(47, 4, 3, 1, 'dfsafdasfsafsfdasf', 0, '2020-04-06 12:40:14', '2020-04-06 12:40:14'),
(48, 4, 3, 1, 'dsfasdfsdafd', 0, '2020-04-06 12:40:18', '2020-04-06 12:40:18'),
(49, 4, 3, 1, 'sdfsfsdfdfas', 0, '2020-04-06 12:40:20', '2020-04-06 12:40:20'),
(50, 3, 4, 1, 'gff', 0, '2020-04-06 12:40:29', '2020-04-06 12:40:29'),
(51, 4, 3, 1, 'dsfsfdasfdsdsf', 0, '2020-04-06 12:40:38', '2020-04-06 12:40:38'),
(52, 3, 4, 1, 'jgfdyftydfytrf', 0, '2020-04-06 12:40:39', '2020-04-06 12:40:39'),
(53, 3, 4, 1, 'jfyrydgfkyrukh fgstj drysets', 0, '2020-04-06 12:40:47', '2020-04-06 12:40:47'),
(54, 4, 3, 1, 'dfsfsfsf', 0, '2020-04-06 13:00:49', '2020-04-06 13:00:49'),
(55, 4, 3, 1, 'fsfdsfdaffasf', 0, '2020-04-06 13:00:54', '2020-04-06 13:00:54'),
(56, 4, 3, 1, 'dsfasdffsfasdf', 0, '2020-04-06 13:00:57', '2020-04-06 13:00:57'),
(57, 3, 4, 1, 'bejhferfherifh yrfieryfhfh3riuf yrferifryifheriyf iuedh rirqerhuier oeirufjweirfjeiufjp iu3rfh3ruifh3rifhirufhiruefh irufirefhriufreuif iurefhfherfei uierfhierufheriufheruifh eruifheruifheruif irufheriufheriufherui irufheruifheiufheriufheiu iruefhierufheruifheiufheruifh ifhejcnejcneiufc efiuheifuhefich iefhefivneifuvnefu eruifruioferuifj ruifhefuiviefvnefvuio eieifneinefvjefieff', 0, '2020-04-06 13:25:12', '2020-04-06 13:25:12'),
(58, 4, 3, 1, 'hello', 0, '2020-04-06 18:05:01', '2020-04-06 18:05:01'),
(59, 3, 4, 1, 'how are you?', 0, '2020-04-06 18:05:12', '2020-04-06 18:05:12'),
(60, 4, 3, 1, 'I am good', 0, '2020-04-06 18:05:28', '2020-04-06 18:05:28'),
(61, 3, 4, 1, 'Hi..', 0, '2020-04-08 07:21:53', '2020-04-08 07:21:53'),
(62, 4, 3, 21, 'Hi.', 0, '2020-04-09 03:34:33', '2020-04-09 03:34:33'),
(63, 10, 29, 34, 'hello i m interested', 0, '2020-04-09 12:07:50', '2020-04-09 12:07:50'),
(64, 29, 10, 34, 'okay lets discuss', 0, '2020-04-09 12:11:25', '2020-04-09 12:11:25'),
(65, 10, 29, 26, 'good goinggg', 0, '2020-04-09 12:11:51', '2020-04-09 12:11:51'),
(66, 10, 29, 34, 'gdrhh b rey ergy bat ay aeh ryj aethaethae rg t gTGWE4 twt W2T4TEDH EG', 0, '2020-04-09 12:14:44', '2020-04-09 12:14:44'),
(67, 29, 10, 35, 'hello', 0, '2020-04-13 06:45:20', '2020-04-13 06:45:20'),
(68, 10, 29, 35, 'hiiii', 0, '2020-04-13 06:46:29', '2020-04-13 06:46:29'),
(69, 10, 29, 34, 'ejwefh ufhwifweui whfilwrfgwiru wflwrfwruifh wefhlwruf rfhilrufhiru wrfhilruwfherui wrufheruifhjhrferjfher rufheruif irufhe ruerhgiuetgh', 0, '2020-04-13 06:47:00', '2020-04-13 06:47:00'),
(70, 29, 10, 34, 'hdqdh udhuiqedhqe qwdhuiqwedh iuedieudh uedhiwuedh uwehuiweedh ewudhwuiecdh', 0, '2020-04-13 06:52:16', '2020-04-13 06:52:16'),
(71, 10, 29, 36, 'lets design i like the work', 0, '2020-04-14 07:17:58', '2020-04-14 07:17:58'),
(72, 29, 10, 36, 'okayyy lets do this i will hire you', 0, '2020-04-14 07:24:09', '2020-04-14 07:24:09'),
(73, 29, 10, 36, 'i am hiring you', 0, '2020-04-14 07:24:22', '2020-04-14 07:24:22'),
(74, 8, 9, 13, 'adsfasfasdf', 0, '2020-04-16 11:22:04', '2020-04-16 11:22:04'),
(75, 9, 4, 13, 'sdlfasfslfa;sfs', 0, '2020-04-16 11:22:48', '2020-04-16 11:22:48'),
(76, 4, 9, 13, 'Hi.', 0, '2020-04-16 11:23:23', '2020-04-16 11:23:23'),
(77, 9, 4, 13, 'How are you?', 0, '2020-04-16 11:23:47', '2020-04-16 11:23:47'),
(78, 4, 9, 13, 'I am good', 0, '2020-04-16 11:23:55', '2020-04-16 11:23:55'),
(79, 8, 9, 13, 'ffff', 0, '2020-04-16 11:24:07', '2020-04-16 11:24:07'),
(80, 3, 4, 21, 'sdffsafds', 0, '2020-04-16 12:59:15', '2020-04-16 12:59:15'),
(81, 10, 29, 35, 'heooo', 0, '2020-04-17 04:46:56', '2020-04-17 04:46:56'),
(82, 29, 10, 38, 'hello', 0, '2020-04-17 04:57:48', '2020-04-17 04:57:48'),
(83, 29, 10, 36, 'oyeeeeee', 0, '2020-04-17 04:58:14', '2020-04-17 04:58:14'),
(84, 10, 29, 36, 'hawww', 0, '2020-04-17 04:58:38', '2020-04-17 04:58:38'),
(85, 29, 10, 26, 'kdcwkwj iuedhwiufh iuedh', 0, '2020-04-17 13:07:56', '2020-04-17 13:07:56'),
(86, 29, 10, 26, 'jasssssssss', 0, '2020-04-17 13:08:27', '2020-04-17 13:08:27'),
(87, 10, 8, 42, 'hi', 0, '2020-04-22 10:02:40', '2020-04-22 10:02:40'),
(88, 8, 10, 42, 'Hi', 0, '2020-04-22 10:03:23', '2020-04-22 10:03:23'),
(89, 8, 10, 42, 'Hi', 0, '2020-04-22 10:03:24', '2020-04-22 10:03:24'),
(90, 10, 8, 42, 'How are you doing?', 0, '2020-04-22 10:03:38', '2020-04-22 10:03:38'),
(91, 10, 8, 44, 'Hi', 0, '2020-04-22 12:32:56', '2020-04-22 12:32:56'),
(92, 8, 10, 44, 'Hi', 0, '2020-04-22 12:33:52', '2020-04-22 12:33:52'),
(93, 8, 10, 44, 'I am good how are you', 0, '2020-04-22 12:34:00', '2020-04-22 12:34:00'),
(94, 10, 8, 44, 'jfgjfkjfjf', 0, '2020-04-22 12:34:12', '2020-04-22 12:34:12'),
(95, 8, 10, 44, ',kfgkjf jyfkuyfy', 0, '2020-04-22 12:34:27', '2020-04-22 12:34:27'),
(96, 4, 9, 45, 'hi..', 0, '2020-05-06 09:36:12', '2020-05-06 09:36:12'),
(97, 9, 4, 45, 'How are you?', 0, '2020-05-06 09:36:37', '2020-05-06 09:36:37'),
(98, 43, 10, 46, 'hello you are interested', 0, '2020-05-06 10:34:05', '2020-05-06 10:34:05'),
(99, 10, 43, 46, 'hiiii', 0, '2020-05-06 10:34:41', '2020-05-06 10:34:41'),
(100, 10, 43, 46, 'yes i m in', 0, '2020-05-06 10:35:05', '2020-05-06 10:35:05'),
(101, 43, 10, 46, 'i am hiring you', 0, '2020-05-06 10:37:36', '2020-05-06 10:37:36'),
(102, 10, 43, 46, 'thankyou', 0, '2020-05-07 10:02:03', '2020-05-07 10:02:03'),
(103, 55, 45, 59, 'hello', 0, '2020-05-13 04:33:56', '2020-05-13 04:33:56'),
(104, 55, 45, 59, 'hello', 0, '2020-05-13 04:33:58', '2020-05-13 04:33:58'),
(105, 45, 55, 59, 'ohh hi', 0, '2020-05-13 04:34:24', '2020-05-13 04:34:24'),
(106, 55, 45, 61, 'Hello', 0, '2020-05-13 07:41:50', '2020-05-13 07:41:50'),
(107, 56, 4, 65, 'Hi..', 0, '2020-05-13 14:21:57', '2020-05-13 14:21:57'),
(108, 4, 56, 65, 'Hello', 0, '2020-05-13 14:22:20', '2020-05-13 14:22:20'),
(109, 74, 73, 95, 'Hello', 0, '2020-05-22 12:32:23', '2020-05-22 12:32:23'),
(110, 64, 63, 87, 'hi', 0, '2020-05-30 10:45:37', '2020-05-30 10:45:37'),
(111, 64, 63, 87, 'as', 0, '2020-05-30 10:45:47', '2020-05-30 10:45:47'),
(112, 76, 69, 97, 'hi', 0, '2020-06-21 01:43:58', '2020-06-21 01:43:58'),
(113, 76, 69, 97, 'hi', 0, '2020-06-21 01:44:12', '2020-06-21 01:44:12'),
(114, 98, 93, 124, 'nbvnbvn', 0, '2020-08-04 08:16:24', '2020-08-04 08:16:24'),
(115, 98, 93, 124, 'nbvnbvn', 0, '2020-08-04 08:16:28', '2020-08-04 08:16:28');

-- --------------------------------------------------------

--
-- Table structure for table `migrations`
--

DROP TABLE IF EXISTS `migrations`;
CREATE TABLE IF NOT EXISTS `migrations` (
  `id` int(10) UNSIGNED NOT NULL AUTO_INCREMENT,
  `migration` varchar(191) COLLATE utf8mb4_unicode_ci NOT NULL,
  `batch` int(11) NOT NULL,
  PRIMARY KEY (`id`)
) ENGINE=InnoDB AUTO_INCREMENT=100 DEFAULT CHARSET=utf8mb4 COLLATE=utf8mb4_unicode_ci;

--
-- Dumping data for table `migrations`
--

INSERT INTO `migrations` (`id`, `migration`, `batch`) VALUES
(1, '2014_10_12_000000_create_users_table', 1),
(2, '2019_08_19_000000_create_failed_jobs_table', 1),
(3, '2020_03_14_053037_add_social_id_to_users', 1),
(4, '2020_03_14_073915_add_todz_id_column_to_users_table', 1),
(5, '2020_03_14_101706_create_projects_table', 1),
(6, '2020_03_14_121922_create_skills_table', 1),
(7, '2020_03_16_060041_add_email_token_to_users', 1),
(8, '2020_03_16_111123_create_project_skills_table', 1),
(9, '2020_03_16_140033_create_talents_table', 1),
(10, '2020_03_17_124805_create_talent_skills_table', 1),
(11, '2020_03_18_133910_create_project_talents_table', 1),
(12, '2020_03_20_092506_add_entity_to_users', 2),
(13, '2020_03_23_100503_create_mileslones_table', 3),
(14, '2020_04_01_081031_create_messages_table', 4),
(15, '2020_04_02_093634_create_project_files_table', 5),
(16, '2020_04_06_084608_add_origin_name_to_project_files_table', 6),
(17, '2020_04_07_074057_add_days_hours_column_to_project_talents_table', 7),
(18, '2020_04_07_101012_add_no_of_hours_columns_to_mileslones_table', 8),
(19, '2020_04_07_131308_add_user_image_column_to_users_table', 9),
(20, '2020_04_08_114818_create_notifications_table', 10),
(21, '2020_04_09_123452_add_talent_user_id_column_to_projects_table', 11),
(22, '2020_04_15_075126_create_coupons_table', 12),
(23, '2020_04_16_104237_create_talent_documents_table', 13),
(24, '2020_04_22_100737_add_online_test_column_to_talents_table', 14),
(25, '2020_04_24_104327_create_test_results_table', 15),
(26, '2020_04_28_091221_create_mangopay_accounts_table', 16),
(27, '2020_05_02_123858_add_hourly_rate_column_to_users_table', 17),
(28, '2020_05_04_070932_create_saved_user_cards_table', 17),
(29, '2020_05_05_044635_create_talent_aptitude_tests_table', 18),
(30, '2020_05_06_081804_create_transactions_table', 19),
(31, '2020_05_07_051207_add_comment_column_to_milestone_table', 20),
(32, '2020_05_07_085411_create_project_payments_table', 21),
(33, '2020_05_08_095555_create_job_categories_table', 22),
(34, '2020_05_08_120748_create_milestone_time_logs_table', 22),
(35, '2020_05_11_032253_add_is_task_runing_column_to_mileslones_table', 22),
(36, '2020_05_11_172949_add_rejec_reason_column_to_talents_table', 23),
(37, '2020_05_12_141909_create_timesheets_table', 24),
(38, '2020_05_14_164501_create_bank_accounts_table', 25),
(39, '2020_05_16_155302_create_bank_payouts_table', 26),
(40, '2020_05_19_165111_add_report_url_column_to_test_results_table', 27),
(41, '2020_05_18_032319_add_is_full_payment_escrow_column_to_projects_table', 28),
(42, '2020_05_21_092822_create_new_columns_users__table', 29),
(43, '2020_05_22_065017_add_deleted_at_to_projects', 30),
(44, '2020_05_22_080738_add_deleted_at_to_project_files', 30),
(45, '2020_05_22_091950_add_deleted_at_to_project_payments', 30),
(46, '2020_05_22_091958_add_deleted_at_to_project_skills', 30),
(47, '2020_05_22_092007_add_deleted_at_to_project_talents', 30),
(48, '2020_05_22_092025_add_deleted_at_to_mileslones', 30),
(49, '2020_05_25_111442_create_new_column_users_table', 31),
(50, '2020_05_26_094243_create_faqs_table', 32),
(51, '2020_05_26_094447_create_site_contents_table', 32),
(53, '2020_05_30_124303_create_escalations_table', 33),
(54, '2020_06_02_053234_add_new_column_projects__table', 34),
(55, '2020_06_04_055121_create_project_ratings_table', 35),
(56, '2020_06_04_045340_add_coupon_type_to_coupons', 36),
(57, '2020_06_04_045401_add_coupon_value_to_coupons', 36),
(58, '2020_06_05_054440_add_aptitude_result_to_talents', 37),
(59, '2020_06_05_104324_add_coupon_id_to_users', 37),
(60, '2020_06_05_104335_add_coupon_to_users', 37),
(61, '2020_06_06_153200_create_new_column_projects_table', 38),
(62, '2020_06_06_103246_add_admin_comment_to_escalations', 39),
(63, '2020_06_06_103317_add_in_favour_to_escalations', 39),
(64, '2020_06_06_103403_add_block_to_users', 39),
(65, '2020_06_07_144334_add_close_marks_projects__table', 40),
(66, '2020_06_08_075142_add_temp_todz_id_users_table', 41),
(67, '2020_06_09_073105_add_corporate_user_new_coulmns', 42),
(68, '2020_06_09_055918_add_hours_approve_to_talents', 43),
(69, '2020_06_11_101449_create_visits_table', 44),
(70, '2020_06_12_044623_add_client_approved_column_timesheets_table', 45),
(71, '2020_06_12_063549_create_admin_comission_table', 46),
(72, '2020_06_13_044626_create_contacts_table', 46),
(73, '2020_06_13_095320_add_coupon_used_column_users__table', 47),
(74, '2020_06_15_111210_add_admin_commision_projects_table', 48),
(75, '2020_06_15_120952_create_admin_revenues_table', 49),
(76, '2020_06_21_154333_add_type_column_talent_documents_table', 50),
(77, '2020_06_22_120635_add_country_column_users_table', 51),
(78, '2020_06_24_095223_add_expected_hourly_rate_users_table', 52),
(79, '2020_06_26_102909_add_is_super_column_users__table', 53),
(80, '2020_06_26_105711_create_permissions_table', 54),
(81, '2020_06_26_105756_create_user_permissions_table', 54),
(83, '2020_07_01_043735_add_fee_rates_column_admin_commissions_table', 55),
(85, '2020_07_01_113934_add_gst_related_column_users_table', 56),
(86, '2020_07_01_125525_add_vat_number_column_admin_commission_table', 57),
(87, '2020_07_02_064500_add_address_column_users_table', 58),
(88, '2020_01_27_183718_create_admins_table', 59),
(89, '2020_07_02_065739_add_coupon_id_coulmn_project_payments__table', 59),
(90, '2020_07_02_065903_add_coupon_id_coulm_transactions_table', 59),
(92, '2020_07_02_104227_add_admin_id_column_manog_tables', 60),
(93, '2020_07_02_135237_add_soft_delete_column_to_users_table', 61),
(94, '2020_07_03_162948_add_milestone_id_column_project_payments_table', 62),
(95, '2020_07_18_041846_add_is_import_user_to_users_table', 63),
(96, '2020_07_20_140205_add_resume_work_sample_field_to_talents_table', 63),
(97, '2020_07_21_121955_add_transaction_type_column_to_transactions_table', 64),
(98, '2020_07_22_083718_add_client_dispute_reason_column_to_projects_table', 65),
(99, '2020_07_28_045423_add_category_column_to_faq_table', 66);

-- --------------------------------------------------------

--
-- Table structure for table `mileslones`
--

DROP TABLE IF EXISTS `mileslones`;
CREATE TABLE IF NOT EXISTS `mileslones` (
  `id` bigint(20) UNSIGNED NOT NULL AUTO_INCREMENT,
  `talent_user_id` bigint(20) UNSIGNED NOT NULL,
  `project_id` bigint(20) UNSIGNED NOT NULL,
  `title` varchar(191) COLLATE utf8mb4_unicode_ci NOT NULL,
  `description` text COLLATE utf8mb4_unicode_ci DEFAULT NULL,
  `start_date` varchar(191) COLLATE utf8mb4_unicode_ci DEFAULT NULL,
  `due_date` varchar(191) COLLATE utf8mb4_unicode_ci DEFAULT NULL,
  `cost` varchar(191) COLLATE utf8mb4_unicode_ci NOT NULL DEFAULT '0',
  `d_description` text COLLATE utf8mb4_unicode_ci DEFAULT NULL,
  `status` varchar(191) COLLATE utf8mb4_unicode_ci NOT NULL DEFAULT '0',
  `created_at` timestamp NULL DEFAULT NULL,
  `updated_at` timestamp NULL DEFAULT NULL,
  `no_of_hours` varchar(191) COLLATE utf8mb4_unicode_ci DEFAULT NULL,
  `comment` text COLLATE utf8mb4_unicode_ci DEFAULT NULL,
  `is_task_runing` int(11) NOT NULL DEFAULT 0,
  `tracker_start_time` varchar(191) COLLATE utf8mb4_unicode_ci DEFAULT NULL,
  `runing_time` varchar(191) COLLATE utf8mb4_unicode_ci DEFAULT NULL,
  `deleted_at` text COLLATE utf8mb4_unicode_ci DEFAULT NULL,
  PRIMARY KEY (`id`),
  KEY `mileslones_talent_user_id_foreign` (`talent_user_id`),
  KEY `mileslones_project_id_foreign` (`project_id`)
) ENGINE=InnoDB AUTO_INCREMENT=98 DEFAULT CHARSET=utf8mb4 COLLATE=utf8mb4_unicode_ci;

--
-- Dumping data for table `mileslones`
--

INSERT INTO `mileslones` (`id`, `talent_user_id`, `project_id`, `title`, `description`, `start_date`, `due_date`, `cost`, `d_description`, `status`, `created_at`, `updated_at`, `no_of_hours`, `comment`, `is_task_runing`, `tracker_start_time`, `runing_time`, `deleted_at`) VALUES
(1, 4, 1, 'What is Lorem Ipsum?', 'Lorem Ipsum is simply dummy text of the printing and typesetting industry. Lorem Ipsum has been the industry\'s standard dummy text ever since the 1500s, when an unknown printer took a galley of type and scrambled it to make a type specimen book. It has survived not only five centuries, but also the leap into electronic typesetting, remaining essentially unchanged. It was popularised in the 1960s with the release of Letraset sheets containing Lorem Ipsum passages, and more recently with desktop publishing software like Aldus PageMaker including versions of Lorem Ipsum.', '03/25/2020', '03/28/2020', '100', 'Lorem Ipsum is simply dummy text of the printing and typesetting industry. Lorem Ipsum has been the industry\'s standard dummy text ever since the 1500s, when an unknown printer took a galley of type and scrambled it to make a type specimen book. It has survived not only five centuries, but also the leap into electronic typesetting, remaining essentially unchanged. It was popularised in the 1960s with the release of Letraset sheets containing Lorem Ipsum passages, and more recently with desktop publishing software like Aldus PageMaker including versions of Lorem Ipsum.', '1', '2020-03-24 11:25:33', '2020-04-04 18:08:51', NULL, NULL, 0, NULL, NULL, NULL),
(2, 11, 7, 'Food Ordering', 'designing', '03/30/2020', '03/31/2020', '2000', 'ooooo', '0', '2020-03-27 07:54:18', '2020-03-27 07:54:18', NULL, NULL, 0, NULL, NULL, NULL),
(3, 12, 12, 'What is Lorem Ipsum?', '0s, when an unknown printer took a galley of type and scrambled it to make a type specimen book. It has survived not only five centuries, but', '04/06/2020', '04/30/2020', '1200', '0s, when an unknown printer took a galley of type and scrambled it to make a type specimen book. It has survived not only five centuries, but', '1', '2020-04-02 12:16:22', '2020-04-02 12:16:48', NULL, NULL, 0, NULL, NULL, NULL),
(4, 11, 6, '50-60', 'designing', '04/06/2020', '04/20/2020', '999', 'jhdjegwegey', '0', '2020-04-03 14:17:18', '2020-04-03 14:17:18', NULL, NULL, 0, NULL, NULL, NULL),
(5, 4, 1, 'asfdsfasf', 'sdfdasfsdf', '04/16/2020', '05/22/2020', '0', 'sdfafdfasdfs asfdsdf', '0', '2020-04-08 10:17:34', '2020-04-08 10:17:34', '80', NULL, 0, NULL, NULL, NULL),
(6, 29, 34, '50-60', 'Gyming', '04/14/2020', '04/20/2020', '0', 'Lets make this happen fast', '0', '2020-04-13 07:11:28', '2020-04-13 07:11:28', '150', NULL, 0, NULL, NULL, NULL),
(7, 29, 36, 'Designing Milestone', 'designing', '04/20/2020', '04/30/2020', '0', 'ewejwejhwjfhwejhf', '0', '2020-04-17 05:06:14', '2020-04-17 05:06:14', '150', NULL, 0, NULL, NULL, NULL),
(8, 29, 40, '50-60', 'Development begin', '04/20/2020', '04/27/2020', '0', 'wdwud uedheiwudh uewdh wdui', '1', '2020-04-17 12:34:02', '2020-04-17 12:34:41', '40', NULL, 0, NULL, NULL, NULL),
(9, 29, 40, '80-90', 'Further development for 80-90', '05/04/2020', '05/25/2020', '0', 'jkwswjw uwxg qiwux wuqxg iquwxh qouwxg iqyxg iqwygx iuqwx ghi', '2', '2020-04-17 12:36:17', '2020-04-17 12:36:40', '45', NULL, 0, NULL, NULL, NULL),
(10, 35, 41, 'Designing', 'designing', '04/20/2020', '04/30/2020', '0', 'efjhrjhrfjrf', '1', '2020-04-17 12:53:23', '2020-04-17 12:55:02', '10', NULL, 0, NULL, NULL, NULL),
(11, 8, 42, 'Miliestone 1', 'Description', '04/22/2020', '05/14/2020', '0', 'Description', '1', '2020-04-22 10:16:13', '2020-04-22 10:18:39', '180', NULL, 0, NULL, NULL, NULL),
(12, 8, 42, 'Milestone 2', 'dqwd', '05/15/2020', '05/31/2020', '0', 'Description', '1', '2020-04-22 10:16:43', '2020-04-22 10:19:01', '120', NULL, 0, NULL, NULL, NULL),
(13, 8, 44, 'Miliestone 1', 'Description', '04/22/2020', '05/15/2020', '0', 'Description', '1', '2020-04-22 12:43:54', '2020-04-22 12:45:22', '100', NULL, 0, NULL, NULL, NULL),
(14, 8, 44, 'Milestone 2', 'Description', '05/16/2020', '05/31/2020', '0', 'wejwjehwkejejwe', '1', '2020-04-22 12:44:28', '2020-04-22 12:49:05', '100', NULL, 0, NULL, NULL, NULL),
(15, 4, 45, 'project setup', 'Lorem Ipsum is simply dummy text of the printing and typesetting industry. Lorem Ipsum has been the industry\'s standard dummy text ever since the 1500s, when an unknown printer took a galley of type and scrambled it to make a type specimen book. It has survived not only five centuries, but also the leap into electronic typesetting, remaining essentially unchanged. It was popularised in the 1960s with the release of Letraset sheets containing Lorem Ipsum passages, and more recently with desktop publishing software like Aldus PageMaker including versions of Lorem Ipsum.', '05/07/2020', '05/07/2020', '0', 'dsfadffas asfdasfasfdasf asfdasfsf asfsd', '1', '2020-05-06 09:34:44', '2020-05-11 06:04:59', '8', 'fsdfdasfasfs', 0, NULL, NULL, NULL),
(16, 4, 45, 'What is Lorem Ipsum?', 'sdafsfsfasfsf', '05/07/2020', '05/08/2020', '0', 'dsfafd asfdfasdas asfsafdas asfdsfdasfdasfdsaf', '0', '2020-05-06 09:35:04', '2020-05-11 06:03:49', '8', NULL, 0, NULL, NULL, NULL),
(17, 43, 46, 'Designing', 'designing', '05/11/2020', '06/08/2020', '0', 'ededdccd', '1', '2020-05-06 10:57:53', '2020-05-07 09:53:30', '90', 'Lets do it', 0, NULL, NULL, NULL),
(18, 4, 51, 'Project Setup', 'Lorem Ipsum is simply dummy text of the printing and typesetting industry. Lorem Ipsum has been the industry\'s standard dummy text ever since the 1500s, when an unknown printer took a galley of type and scrambled it to make a type specimen book. It has survived not only five centuries, but also the leap into electronic typesetting, remaining essentially unchanged. It was popularised in the 1960s with the release of Letraset sheets containing Lorem Ipsum passages, and more recently with desktop publishing software like Aldus PageMaker including versions of Lorem Ipsum.', '05/09/2020', '05/13/2020', '0', 'Lorem Ipsum is simply dummy text of the printing and typesetting industry. Lorem Ipsum has been the industry\'s standard dummy text ever since the 1500s, when an unknown printer took a galley of type and scrambled it to make a type specimen book. It has survived not only five centuries, but also the leap into electronic typesetting, remaining essentially unchanged. It was popularised in the 1960s with the release of Letraset sheets containing Lorem Ipsum passages, and more recently with desktop publishing software like Aldus PageMaker including versions of Lorem Ipsum.', '1', '2020-05-08 06:55:26', '2020-05-12 02:37:39', '6', 'done', 2, NULL, '175', NULL),
(19, 4, 51, 'login signup api', 'Lorem Ipsum is simply dummy text of the printing and typesetting industry. Lorem Ipsum has been the industry\'s standard dummy text ever since the 1500s, when an unknown printer took a galley of type and scrambled it to make a type specimen book. It has survived not only five centuries, but also the leap into electronic typesetting, remaining essentially unchanged. It was popularised in the 1960s with the release of Letraset sheets containing Lorem Ipsum passages, and more recently with desktop publishing software like Aldus PageMaker including versions of Lorem Ipsum.', '05/11/2020', '05/12/2020', '0', 'Lorem Ipsum is simply dummy text of the printing and typesetting industry. Lorem Ipsum has been the industry\'s standard dummy text ever since the 1500s, when an unknown printer took a galley of type and scrambled it to make a type specimen book. It has survived not only five centuries, but also the leap into electronic typesetting, remaining essentially unchanged. It was popularised in the 1960s with the release of Letraset sheets containing Lorem Ipsum passages, and more recently with desktop publishing software like Aldus PageMaker including versions of Lorem Ipsum.', '1', '2020-05-08 06:55:47', '2020-05-12 02:38:58', '8', 'dfasdfsaf', 2, NULL, '71', NULL),
(20, 4, 51, 'users listing api', 'Lorem Ipsum is simply dummy text of the printing and typesetting industry. Lorem Ipsum has been the industry\'s standard dummy text ever since the 1500s, when an unknown printer took a galley of type and scrambled it to make a type specimen book. It has survived not only five centuries, but also the leap into electronic typesetting, remaining essentially unchanged. It was popularised in the 1960s with the release of Letraset sheets containing Lorem Ipsum passages, and more recently with desktop publishing software like Aldus PageMaker including versions of Lorem Ipsum.', '05/14/2020', '05/14/2020', '0', 'Lorem Ipsum is simply dummy text of the printing and typesetting industry. Lorem Ipsum has been the industry\'s standard dummy text ever since the 1500s, when an unknown printer took a galley of type and scrambled it to make a type specimen book. It has survived not only five centuries, but also the leap into electronic typesetting, remaining essentially unchanged. It was popularised in the 1960s with the release of Letraset sheets containing Lorem Ipsum passages, and more recently with desktop publishing software like Aldus PageMaker including versions of Lorem Ipsum.', '1', '2020-05-08 06:56:14', '2020-05-11 06:06:26', '20', 'fdsfasfasdf', 0, NULL, NULL, NULL),
(21, 4, 51, 'profile update api', 'Lorem Ipsum is simply dummy text of the printing and typesetting industry. Lorem Ipsum has been the industry\'s standard dummy text ever since the 1500s, when an unknown printer took a galley of type and scrambled it to make a type specimen book. It has survived not only five centuries, but also the leap into electronic typesetting, remaining essentially unchanged. It was popularised in the 1960s with the release of Letraset sheets containing Lorem Ipsum passages, and more recently with desktop publishing software like Aldus PageMaker including versions of Lorem Ipsum.', '05/14/2020', '05/16/2020', '0', 'dsfafd asfdfasdas asfsafdas asfdsfdasfdasfdsaf', '1', '2020-05-08 06:58:51', '2020-05-11 06:06:30', '8', 'afdfasfdasf', 0, NULL, NULL, NULL),
(22, 4, 53, 'What is Lorem Ipsum?', 'Lorem Ipsum is simply dummy text of the printing and typesetting industry. Lorem Ipsum has been the industry\'s standard dummy text ever since the 1500s, when an unknown printer took a galley of type and scrambled it to make a type specimen book. It has survived not only five centuries, but also the leap into electronic typesetting, remaining essentially unchanged. It was popularised in the 1960s with the release of Letraset sheets containing Lorem Ipsum passages, and more recently with desktop publishing software like Aldus PageMaker including versions of Lorem Ipsum.', '05/13/2020', '05/20/2020', '0', 'dsfadffas asfdasfasfdasf asfdasfsf asfsd', '1', '2020-05-08 07:46:39', '2020-05-08 07:50:23', '8', 'dgfdgfdgfdg', 0, NULL, NULL, NULL),
(23, 4, 53, 'Where does it come from?', 'sdafsfsfasfsf', '05/22/2020', '05/23/2020', '0', 'dsfasf asfdasfs afdsfdas afsfasdf asfafdas asfdfsf', '1', '2020-05-08 07:49:44', '2020-05-08 07:50:34', '20', 'sfsfsfffsasdf', 0, NULL, NULL, NULL),
(24, 4, 53, 'hjasdfkjasf dksfhasfkjhasfkjshaf dkjsh', 'kjdshfdkjashfdksfdajsfls ;fjdlasfjsa;l j', '05/21/2020', '05/22/2020', '0', 'dsfasf asfdasfs afdsfdas afsfasdf asfafdas asfdfsf', '1', '2020-05-08 07:49:59', '2020-05-08 07:51:07', '20', 'fdsfafdfs', 0, NULL, NULL, NULL),
(25, 43, 46, '50-60%', 'Development', '05/25/2020', '06/22/2020', '0', 'ppppp', '0', '2020-05-08 11:43:32', '2020-05-08 11:43:32', '150', NULL, 0, NULL, NULL, NULL),
(26, 4, 32, 'Project setup', 'dlfjsdlkfj slfkjkl j', '05/13/2020', '05/13/2020', '0', 'lskdfjslkfj dsfjdslk fjl', '0', '2020-05-12 02:39:38', '2020-05-12 02:44:51', '8', NULL, 2, NULL, '9', NULL),
(27, 4, 32, 'sdflksdjflkj', 'lksdjfklsdjflkj', '05/14/2020', '05/14/2020', '0', 'lkfdjsklfjslkfjs', '0', '2020-05-12 02:39:55', '2020-05-12 04:42:09', '8', NULL, 2, NULL, '76', NULL),
(28, 4, 32, 'qqqqqqqq', 'klfslkfjdslkfjl', '05/15/2020', '05/15/2020', '0', 'kldsfjdsklfjsdkfsjf', '0', '2020-05-12 02:40:16', '2020-05-12 02:40:16', '8', NULL, 0, NULL, NULL, NULL),
(29, 55, 59, 'Development', 'Development', '05/18/2020', '06/18/2020', '0', 'dkuhreudh u 3drhy3 iu dh3 di3', '0', '2020-05-13 04:36:24', '2020-05-13 04:36:24', '180', NULL, 0, NULL, NULL, NULL),
(30, 55, 61, 'Designing', 'designing', '05/18/2020', '06/18/2020', '0', 'hdhdd dhdhdhh dhdd', '0', '2020-05-13 06:39:32', '2020-05-13 06:39:32', '180', NULL, 0, NULL, NULL, NULL),
(31, 4, 65, 'Project setup', 'Lorem Ipsum is simply dummy text of the printing and typesetting industry. Lorem Ipsum has been the industry\'s standard dummy text ever since the 1500s, when an unknown printer took a galley of type and scrambled it to make a type specimen book. It has survived not only five centuries, but also the leap into electronic typesetting, remaining essentially unchanged. It was popularised in the 1960s with the release of Letraset sheets containing Lorem Ipsum passages, and more recently with desktop publishing software like Aldus PageMaker including versions of Lorem Ipsum.', '05/14/2020', '05/14/2020', '0', 'Lorem Ipsum is simply dummy text of the printing and typesetting industry. Lorem Ipsum has been the industry\'s standard dummy text ever since the 1500s, when an unknown printer took a galley of type and scrambled it to make a type specimen book. It has survived not only five centuries, but also the leap into electronic typesetting, remaining essentially unchanged. It was popularised in the 1960s with the release of Letraset sheets containing Lorem Ipsum passages, and more recently with desktop publishing software like Aldus PageMaker including versions of Lorem Ipsum.', '0', '2020-05-13 14:32:01', '2020-05-13 14:32:52', '8', NULL, 1, '1589380372', NULL, NULL),
(32, 4, 65, 'Login api create', 'Lorem Ipsum is simply dummy text of the printing and typesetting industry. Lorem Ipsum has been the industry\'s standard dummy text ever since the 1500s, when an unknown printer took a galley of type and scrambled it to make a type specimen book. It has survived not only five centuries, but also the leap into electronic typesetting, remaining essentially unchanged. It was popularised in the 1960s with the release of Letraset sheets containing Lorem Ipsum passages, and more recently with desktop publishing software like Aldus PageMaker including versions of Lorem Ipsum.', '05/15/2020', '05/15/2020', '0', 'Lorem Ipsum is simply dummy text of the printing and typesetting industry. Lorem Ipsum has been the industry\'s standard dummy text ever since the 1500s, when an unknown printer took a galley of type and scrambled it to make a type specimen book. It has survived not only five centuries, but also the leap into electronic typesetting, remaining essentially unchanged. It was popularised in the 1960s with the release of Letraset sheets containing Lorem Ipsum passages, and more recently with desktop publishing software like Aldus PageMaker including versions of Lorem Ipsum.', '0', '2020-05-13 14:32:41', '2020-05-13 14:32:41', '8', NULL, 0, NULL, NULL, NULL),
(33, 55, 59, 'Designing', 'designing', '05/18/2020', '05/27/2020', '0', 'udhweuidweuid', '0', '2020-05-18 04:16:48', '2020-05-18 04:16:48', '70', NULL, 0, NULL, NULL, NULL),
(34, 55, 67, '50-60', 'jhdwedwehd', '05/18/2020', '05/27/2020', '0', 'dhddd', '1', '2020-05-18 04:17:32', '2020-05-18 04:38:10', '70', 'hdhdhdjd', 2, NULL, '36', NULL),
(35, 55, 67, 'Designing', 'ssss', '05/28/2020', '05/31/2020', '0', 'hdhdhd', '1', '2020-05-18 04:26:32', '2020-05-18 04:29:22', '20', 'ffc', 0, NULL, NULL, NULL),
(36, 55, 69, 'Designing', 'ddd', '05/18/2020', '05/20/2020', '0', 'ee', '1', '2020-05-18 04:58:33', '2020-05-18 04:59:13', '20', 'ddd', 0, NULL, NULL, NULL),
(37, 55, 69, 'development', 'ddd', '05/21/2020', '05/22/2020', '0', 'dd', '0', '2020-05-18 05:01:12', '2020-05-18 05:01:12', '20', NULL, 0, NULL, NULL, NULL),
(38, 58, 77, 'Designing', 'designing', '05/18/2020', '05/20/2020', '0', 'jhdjegwegey', '0', '2020-05-18 08:13:40', '2020-05-18 08:13:40', '20', NULL, 0, NULL, NULL, NULL),
(39, 58, 79, '50-60', 'designing', '05/18/2020', '05/21/2020', '0', 'ehehedhdh', '0', '2020-05-18 08:28:27', '2020-05-25 06:43:51', '10', NULL, 0, NULL, NULL, '2020-05-25 06:43:51'),
(40, 58, 81, 'Designing', 'designing', '05/18/2020', '05/21/2020', '0', 'ooooo', '0', '2020-05-18 08:31:31', '2020-05-18 08:31:31', '10', NULL, 0, NULL, NULL, NULL),
(41, 58, 71, 'Designing', 'designing', '05/18/2020', '05/21/2020', '0', 'ooooo', '1', '2020-05-18 08:59:51', '2020-05-18 09:04:09', '20', 'hhhh', 2, NULL, '15', NULL),
(42, 58, 71, '50-60', 'Development', '05/22/2020', '05/26/2020', '0', 'jhdjegwegey', '1', '2020-05-18 09:07:13', '2020-05-20 04:23:13', '20', 'sss', 1, '1589948593', '0', NULL),
(43, 58, 71, '80-90', 'Development', '05/21/2020', '05/21/2020', '0', 'ooooo', '0', '2020-05-20 04:24:52', '2020-05-20 04:24:52', '5', NULL, 0, NULL, NULL, NULL),
(44, 4, 83, 'project setup', 'dlksfslkdjlk', '05/21/2020', '05/25/2020', '0', 'sdfsfsdfds', '0', '2020-05-21 02:31:09', '2020-05-21 02:31:09', '25', NULL, 0, NULL, NULL, NULL),
(45, 63, 87, '50-60', 'Development', '05/21/2020', '05/21/2020', '0', 'hdhdhdh', '1', '2020-05-21 07:12:23', '2020-05-30 10:59:31', '5', 'jdhddh', 2, NULL, '122', NULL),
(46, 4, 83, 'dfslfkjsdfjsdlk', 'sdfdsfsdf', '05/22/2020', '05/27/2020', '0', 'ldfjsdkfsdlkfj', '0', '2020-05-21 17:35:54', '2020-05-21 17:35:54', '20', NULL, 0, NULL, NULL, NULL),
(47, 4, 88, 'project setup', 'lsfjlsjfl', '05/23/2020', '05/25/2020', '0', 'sdflksdlkfjslkfj', '1', '2020-05-21 17:37:49', '2020-05-21 17:38:10', '20', 'kdsfjlfjsdlfdjslfdjs', 0, NULL, NULL, NULL),
(48, 4, 88, 'sdlfjsdflj', 'ldflkjsldfj', '05/26/2020', '05/27/2020', '0', 'fsldkfjldsfjds', '1', '2020-05-21 17:39:25', '2020-05-21 17:40:19', '5', 'sdfjsldfjdslf', 0, NULL, NULL, NULL),
(49, 4, 88, 'lfksdjfklsj', 'ljflsdjfl', '05/28/2020', '05/31/2020', '0', 'lkdfjsdklfjs', '1', '2020-05-21 17:45:54', '2020-05-21 17:46:12', '15', 'dlkfjdflsjdlfk', 0, NULL, NULL, NULL),
(50, 63, 89, 'UI/UX', 'designing', '05/22/2020', '05/22/2020', '0', 'uhuhcuhcfuhuhuhuhruhcfu wrukrjfjfjcfjcfhcf cf cfoldrkdr', '1', '2020-05-22 05:11:50', '2020-05-22 05:40:09', '1', 'waoo', 2, NULL, '581', NULL),
(51, 63, 90, 'UI/UX', 'designing', '05/22/2020', '05/25/2020', '0', 'uhuhcuhcfuhuhuhuhruhcfu wrukrjfjfjcfjcfhcf cf cfoldrkdr', '1', '2020-05-22 07:00:53', '2020-05-22 09:25:00', '1', 'lets start', 2, NULL, '1272', NULL),
(52, 63, 90, '50-60', 'Project Setup', '05/26/2020', '05/26/2020', '0', 'rrrr', '1', '2020-05-22 07:06:23', '2020-05-22 09:26:22', '2', 'jsahshxh', 1, '1590139582', '9', NULL),
(53, 71, 91, 'Designing', 'UI/UX', '05/22/2020', '05/22/2020', '0', 'uhuhcuhcfuhuhuhuhruhcfu wrukrjfjfjcfjcfhcf cf cfoldrkdr', '1', '2020-05-22 10:22:59', '2020-05-22 10:38:34', '1', 'jhcdh', 2, NULL, '546', NULL),
(54, 71, 91, '50-60', 'Development', '05/22/2020', '05/22/2020', '0', 'cdhjhhcdhsd', '2', '2020-05-22 10:37:38', '2020-05-22 10:41:42', '9', 'eee', 2, NULL, '89', NULL),
(55, 71, 91, '50-60', 'Development', '05/22/2020', '05/22/2020', '0', 'cdhjhhcdhsd', '0', '2020-05-22 10:37:38', '2020-05-22 10:37:38', '9', NULL, 0, NULL, NULL, NULL),
(56, 71, 92, 'Designing', 'UI/UX', '05/22/2020', '05/22/2020', '0', 'uhedjsd edfjhsdfhsdfh', '1', '2020-05-22 10:46:54', '2020-05-22 10:57:07', '50', 'wewed', 1, '1590145027', NULL, NULL),
(57, 71, 92, '50-60', 'Development', '05/22/2020', '05/26/2020', '0', 'hdhdhdjdjd', '1', '2020-05-22 10:47:26', '2020-05-22 10:53:48', '50', 'jhhhh', 0, NULL, NULL, NULL),
(58, 71, 93, 'Designing', 'designing', '05/22/2020', '05/22/2020', '0', 'cdjhhjcdjh', '1', '2020-05-22 11:09:13', '2020-05-22 11:10:47', '50', 'eee', 0, NULL, NULL, NULL),
(59, 71, 93, '50-60', 'Development', '05/22/2020', '05/22/2020', '0', 'hdhdh', '1', '2020-05-22 11:09:36', '2020-05-22 11:11:13', '50', 'ssws', 0, NULL, NULL, NULL),
(60, 71, 94, 'Designing', 'designing', '05/22/2020', '05/22/2020', '0', 'ndhdhdh', '1', '2020-05-22 11:27:29', '2020-05-22 11:31:33', '25', 'sss', 0, NULL, NULL, NULL),
(61, 71, 94, '50-60', 'Development', '05/22/2020', '05/22/2020', '0', 'jhcdhhced', '1', '2020-05-22 11:27:49', '2020-05-22 11:32:11', '25', 'eee', 0, NULL, NULL, NULL),
(62, 71, 94, '80-90', 'Development', '05/22/2020', '05/22/2020', '0', 'hdhdhdh', '1', '2020-05-22 11:28:29', '2020-05-22 11:33:31', '50', 'dcdd', 0, NULL, NULL, NULL),
(63, 73, 95, 'Designing', 'designing', '05/22/2020', '05/22/2020', '0', 'nfccfn', '1', '2020-05-22 12:36:54', '2020-05-22 12:48:06', '50', 'wao', 2, NULL, '9', NULL),
(64, 73, 95, '50-60', 'Development', '05/25/2020', '05/26/2020', '0', 'working', '1', '2020-05-22 12:37:36', '2020-05-22 12:49:08', '50', 'wao', 0, NULL, NULL, NULL),
(65, 73, 96, 'Designing', 'designing', '05/22/2020', '05/26/2020', '0', 'hshssh', '1', '2020-05-22 12:52:59', '2020-05-22 12:55:03', '25', 'wao', 0, NULL, NULL, NULL),
(66, 73, 96, '50-60', 'Development', '05/27/2020', '05/29/2020', '0', 'hhsh', '1', '2020-05-22 12:53:22', '2020-05-22 12:56:33', '25', 'aa', 0, NULL, NULL, NULL),
(67, 73, 96, '80-90', 'Development', '05/29/2020', '05/30/2020', '0', 'sss', '1', '2020-05-22 12:53:47', '2020-05-22 13:01:00', '50', 'ww', 0, NULL, NULL, NULL),
(68, 73, 99, 'Designing', 'UI/UX', '05/28/2020', '05/31/2020', '0', 'hshxhxh', '1', '2020-05-28 12:26:26', '2020-05-28 12:35:52', '50', 'ndhdhdh', 2, NULL, '72', NULL),
(69, 73, 99, '50-60', 'Development', '06/01/2020', '06/05/2020', '0', 'hshshxh', '1', '2020-05-28 12:27:02', '2020-05-28 12:30:33', '50', 'hxhxh', 0, NULL, NULL, NULL),
(70, 69, 101, 'What fitness category do you belong to?', 'test', '06/10/2020', '06/18/2020', '0', 'test', '0', '2020-06-01 06:54:49', '2020-06-01 06:54:49', '2', NULL, 0, NULL, NULL, NULL),
(71, 63, 87, 'test', 'test', '06/06/2020', '06/06/2020', '0', 'asd', '1', '2020-06-06 04:50:28', '2020-06-06 04:51:32', '1', 'asd', 0, NULL, NULL, NULL),
(72, 69, 106, 'What\'s your name ?', 'asddsf', '06/08/2020', '06/08/2020', '0', 'asd', '0', '2020-06-08 08:16:54', '2020-06-08 08:16:54', '2', NULL, 0, NULL, NULL, NULL),
(73, 69, 106, 'test', 'test', '06/22/2020', '06/24/2020', '0', 'test', '0', '2020-06-21 01:32:50', '2020-06-21 01:32:50', '2', NULL, 0, NULL, NULL, NULL),
(74, 69, 97, 'test', 'test', '06/23/2020', '06/25/2020', '0', 'test', '0', '2020-06-21 01:33:34', '2020-06-21 01:33:34', '2', NULL, 0, NULL, NULL, NULL),
(75, 69, 113, 'test', 'test', '06/24/2020', '06/24/2020', '0', 'test', '1', '2020-06-21 07:34:02', '2020-06-21 07:35:11', '2', 'tesyt', 0, NULL, NULL, NULL),
(76, 69, 114, 'test', 'test', '06/23/2020', '06/26/2020', '0', 'test', '1', '2020-06-22 04:54:20', '2020-06-22 04:54:55', '2', 'approved', 0, NULL, NULL, NULL),
(77, 69, 114, 'test', 'test', '06/22/2020', '06/25/2020', '0', 'test', '1', '2020-06-22 04:55:44', '2020-06-22 04:56:05', '2', 'test', 0, NULL, NULL, NULL),
(78, 69, 115, 'test', 'test', '06/22/2020', '06/26/2020', '0', 'test', '1', '2020-06-22 06:22:53', '2020-06-22 06:26:03', '20', 'test', 0, NULL, NULL, NULL),
(79, 69, 110, 'test', 'test', '06/24/2020', '06/26/2020', '0', 'test', '1', '2020-06-24 07:09:54', '2020-06-24 07:10:17', '2', 'test', 0, NULL, NULL, NULL),
(80, 69, 119, 'milestone 101', 'test description', '07/03/2020', '07/10/2020', '0', 'test', '1', '2020-07-03 12:01:10', '2020-07-03 12:04:06', '1', 'test added', 0, NULL, NULL, NULL),
(81, 69, 119, 'milestone 102 final email for client test', 'test description', '07/03/2020', '07/03/2020', '0', 'easd', '1', '2020-07-03 12:14:06', '2020-07-03 12:15:22', '1', 'test', 0, NULL, NULL, NULL),
(82, 69, 119, 'milestone 102 final email for client test', 'test description', '07/03/2020', '07/03/2020', '0', 'easd', '1', '2020-07-03 12:14:08', '2020-07-03 13:20:42', '1', 'final email check', 0, NULL, NULL, NULL),
(83, 69, 119, 'milestone 102 final email for client test', 'test description', '07/03/2020', '07/03/2020', '0', 'easd', '1', '2020-07-03 12:14:08', '2020-07-03 13:23:48', '1', 'test', 0, NULL, NULL, NULL),
(84, 69, 119, 'milestone 102 final email for client test', 'test description', '07/03/2020', '07/03/2020', '0', 'easd', '1', '2020-07-03 12:14:09', '2020-08-05 06:08:46', '1', 'some dummy comment', 0, NULL, NULL, NULL),
(85, 69, 119, 'milestone 102 final email for client test', 'test description', '07/03/2020', '07/03/2020', '0', 'easd', '0', '2020-07-03 12:14:09', '2020-07-03 12:14:09', '1', NULL, 0, NULL, NULL, NULL),
(86, 69, 105, 'What fitness category do you belong to?', 'test', '07/23/2020', '07/24/2020', '0', 'khk', '0', '2020-07-22 04:57:20', '2020-07-22 04:57:20', '3', NULL, 0, NULL, NULL, NULL),
(87, 98, 124, 'Milestone1', 'some dummy description', '08/04/2020', '11/19/2020', '0', 'some some', '0', '2020-08-04 06:10:52', '2020-08-07 06:33:22', '65', NULL, 2, NULL, '11', NULL),
(88, 98, 124, 'milestone2', 'dgsg', '08/14/2020', '08/21/2020', '0', 'gfhfgh', '0', '2020-08-04 06:32:28', '2020-08-04 07:36:18', '76', NULL, 2, NULL, '11', NULL),
(89, 98, 130, 'test11', 'dummy description', '08/08/2020', '08/12/2020', '0', 'some some', '0', '2020-08-07 23:37:48', '2020-08-07 23:46:20', '45', NULL, 2, NULL, '10', NULL),
(90, 98, 130, 'test2', 'dummy description', '08/08/2020', '01/15/2021', '0', 'nbvnbvnb', '0', '2020-08-07 23:51:32', '2020-08-07 23:51:32', '65', NULL, 0, NULL, NULL, NULL),
(91, 98, 130, 'test3', 'dummy description', '08/08/2020', '01/07/2021', '0', 'nbvnvnbvn', '0', '2020-08-07 23:55:15', '2020-08-07 23:55:15', '76', NULL, 0, NULL, NULL, NULL),
(92, 98, 130, 'test4', 'dummy description', '08/08/2020', '01/21/2021', '0', 'hgfhgfhgfh', '0', '2020-08-08 00:01:15', '2020-08-08 00:01:15', '54', NULL, 0, NULL, NULL, NULL),
(93, 98, 130, 'test5', 'dummy description', '08/08/2020', '02/19/2021', '0', 'nhvnvnb', '0', '2020-08-08 00:03:56', '2020-08-08 00:04:28', '76', NULL, 2, NULL, '14', NULL),
(94, 98, 130, 'test7', 'mnbmnb', '08/08/2020', '11/21/2020', '0', 'cbcbvcb', '0', '2020-08-08 00:07:58', '2020-08-08 00:08:16', '76', NULL, 1, '1596865096', NULL, NULL),
(95, 98, 130, 'test8', 'dummy description', '08/08/2020', '11/21/2020', '0', 'jhgjhgjh', '0', '2020-08-08 00:15:57', '2020-08-08 00:15:57', '76', NULL, 0, NULL, NULL, NULL),
(96, 98, 130, 'test9', 'dummy description', '08/08/2020', '12/18/2020', '0', 'nbvnvnbvn', '0', '2020-08-08 00:51:27', '2020-08-08 00:51:27', '45', NULL, 0, NULL, NULL, NULL),
(97, 98, 130, 'test10', 'dummy description', '08/08/2020', '01/23/2021', '0', 'nbvnbvnb', '0', '2020-08-08 00:53:59', '2020-08-08 00:53:59', '45', NULL, 0, NULL, NULL, NULL);

-- --------------------------------------------------------

--
-- Table structure for table `milestone_time_logs`
--

DROP TABLE IF EXISTS `milestone_time_logs`;
CREATE TABLE IF NOT EXISTS `milestone_time_logs` (
  `id` bigint(20) UNSIGNED NOT NULL AUTO_INCREMENT,
  `milestone_id` varchar(191) COLLATE utf8mb4_unicode_ci NOT NULL,
  `project_id` varchar(191) COLLATE utf8mb4_unicode_ci NOT NULL,
  `talent_user_id` varchar(191) COLLATE utf8mb4_unicode_ci NOT NULL,
  `start_time` varchar(191) COLLATE utf8mb4_unicode_ci DEFAULT NULL,
  `end_time` varchar(191) COLLATE utf8mb4_unicode_ci DEFAULT NULL,
  `total_time` varchar(191) COLLATE utf8mb4_unicode_ci DEFAULT NULL,
  `created_at` timestamp NULL DEFAULT NULL,
  `updated_at` timestamp NULL DEFAULT NULL,
  PRIMARY KEY (`id`)
) ENGINE=InnoDB DEFAULT CHARSET=utf8mb4 COLLATE=utf8mb4_unicode_ci;

-- --------------------------------------------------------

--
-- Table structure for table `notifications`
--

DROP TABLE IF EXISTS `notifications`;
CREATE TABLE IF NOT EXISTS `notifications` (
  `id` bigint(20) UNSIGNED NOT NULL AUTO_INCREMENT,
  `to_id` bigint(20) UNSIGNED DEFAULT NULL,
  `from_id` bigint(20) UNSIGNED DEFAULT NULL,
  `type` bigint(20) UNSIGNED NOT NULL,
  `ref` bigint(20) UNSIGNED DEFAULT NULL,
  `message` text COLLATE utf8mb4_unicode_ci DEFAULT NULL,
  `is_read` int(11) NOT NULL DEFAULT 0,
  `created_at` timestamp NULL DEFAULT NULL,
  `updated_at` timestamp NULL DEFAULT NULL,
  PRIMARY KEY (`id`)
) ENGINE=InnoDB AUTO_INCREMENT=723 DEFAULT CHARSET=utf8mb4 COLLATE=utf8mb4_unicode_ci;

--
-- Dumping data for table `notifications`
--

INSERT INTO `notifications` (`id`, `to_id`, `from_id`, `type`, `ref`, `message`, `is_read`, `created_at`, `updated_at`) VALUES
(1, 4, 9, 1, 32, '5E7B4CFBDEE78 client has sent project invitation', 1, '2020-04-09 08:50:10', '2020-04-09 08:51:05'),
(2, 8, 9, 1, 32, '5E7B4CFBDEE78 client has sent project invitation', 0, '2020-04-09 08:50:10', '2020-04-09 08:50:10'),
(3, 9, 4, 2, 32, '5E74552499F31 todder has accepted project invitation', 1, '2020-04-09 08:51:34', '2020-04-21 13:42:07'),
(4, 4, 10, 1, 33, '5E7C4B6387A54 client has sent project invitation', 1, '2020-04-09 11:16:29', '2020-04-10 04:35:59'),
(5, 8, 10, 1, 33, '5E7C4B6387A54 client has sent project invitation', 0, '2020-04-09 11:16:29', '2020-04-09 11:16:29'),
(6, 11, 10, 1, 33, '5E7C4B6387A54 client has sent project invitation', 0, '2020-04-09 11:16:29', '2020-04-09 11:16:29'),
(7, 12, 10, 1, 33, '5E7C4B6387A54 client has sent project invitation', 0, '2020-04-09 11:16:29', '2020-04-09 11:16:29'),
(8, 28, 10, 1, 33, '5E7C4B6387A54 client has sent project invitation', 0, '2020-04-09 11:16:29', '2020-04-09 11:16:29'),
(9, 29, 10, 1, 34, '5E7C4B6387A54 client has sent project invitation', 1, '2020-04-09 12:07:06', '2020-04-13 06:58:13'),
(10, 4, 9, 4, 32, '5E7B4CFBDEE78 client has hired you on ', 0, '2020-04-09 14:06:31', '2020-04-09 14:06:31'),
(11, 4, 10, 1, 35, '5E7C4B6387A54 client has sent project invitation', 0, '2020-04-13 06:44:36', '2020-04-13 06:44:36'),
(12, 8, 10, 1, 35, '5E7C4B6387A54 client has sent project invitation', 0, '2020-04-13 06:44:36', '2020-04-13 06:44:36'),
(13, 12, 10, 1, 35, '5E7C4B6387A54 client has sent project invitation', 0, '2020-04-13 06:44:36', '2020-04-13 06:44:36'),
(14, 28, 10, 1, 35, '5E7C4B6387A54 client has sent project invitation', 0, '2020-04-13 06:44:36', '2020-04-13 06:44:36'),
(15, 29, 10, 1, 35, '5E7C4B6387A54 client has sent project invitation', 1, '2020-04-13 06:44:36', '2020-04-13 06:58:15'),
(16, 10, 29, 2, 34, '5E885D11C todder has accepted project invitation', 1, '2020-04-13 06:52:57', '2020-04-13 06:56:38'),
(17, 10, 29, 2, 35, '5E885D11C todder has accepted project invitation', 1, '2020-04-13 07:18:25', '2020-04-14 07:27:47'),
(18, 29, 10, 4, 34, '5E7C4B6387A54 client has hired you on Push', 0, '2020-04-13 07:45:04', '2020-04-13 07:45:04'),
(19, 10, 4, 2, 35, '5E74552499F31 todder has accepted project invitation', 1, '2020-04-13 11:05:55', '2020-04-14 09:02:12'),
(20, 4, 10, 1, 36, '5E7C4B6387A54 client has sent project invitation', 0, '2020-04-14 07:12:02', '2020-04-14 07:12:02'),
(21, 8, 10, 1, 36, '5E7C4B6387A54 client has sent project invitation', 0, '2020-04-14 07:12:02', '2020-04-14 07:12:02'),
(22, 12, 10, 1, 36, '5E7C4B6387A54 client has sent project invitation', 0, '2020-04-14 07:12:02', '2020-04-14 07:12:02'),
(23, 29, 10, 1, 36, '5E7C4B6387A54 client has sent project invitation', 0, '2020-04-14 07:12:02', '2020-04-14 07:12:02'),
(24, 33, 10, 1, 36, '5E7C4B6387A54 client has sent project invitation', 0, '2020-04-14 07:12:02', '2020-04-14 07:12:02'),
(25, 10, 29, 2, 36, '5E885D11C todder has accepted project invitation', 1, '2020-04-14 07:24:56', '2020-04-14 09:02:35'),
(26, 4, 10, 1, 37, '5E7C4B6387A54 client has sent project invitation', 0, '2020-04-17 04:45:36', '2020-04-17 04:45:36'),
(27, 8, 10, 1, 37, '5E7C4B6387A54 client has sent project invitation', 0, '2020-04-17 04:45:36', '2020-04-17 04:45:36'),
(28, 28, 10, 1, 37, '5E7C4B6387A54 client has sent project invitation', 0, '2020-04-17 04:45:36', '2020-04-17 04:45:36'),
(29, 29, 10, 1, 37, '5E7C4B6387A54 client has sent project invitation', 0, '2020-04-17 04:45:36', '2020-04-17 04:45:36'),
(30, 33, 10, 1, 37, '5E7C4B6387A54 client has sent project invitation', 0, '2020-04-17 04:45:36', '2020-04-17 04:45:36'),
(31, 4, 10, 1, 38, '5E7C4B6387A54 client has sent project invitation', 0, '2020-04-17 04:56:43', '2020-04-17 04:56:43'),
(32, 12, 10, 1, 38, '5E7C4B6387A54 client has sent project invitation', 0, '2020-04-17 04:56:43', '2020-04-17 04:56:43'),
(33, 28, 10, 1, 38, '5E7C4B6387A54 client has sent project invitation', 0, '2020-04-17 04:56:43', '2020-04-17 04:56:43'),
(34, 29, 10, 1, 38, '5E7C4B6387A54 client has sent project invitation', 0, '2020-04-17 04:56:43', '2020-04-17 04:56:43'),
(35, 33, 10, 1, 38, '5E7C4B6387A54 client has sent project invitation', 0, '2020-04-17 04:56:43', '2020-04-17 04:56:43'),
(36, 10, 29, 2, 38, '5E885D11C todder has accepted project invitation', 1, '2020-04-17 05:01:02', '2020-04-17 06:17:00'),
(37, 9, 29, 3, 37, '5E885D11C todder has rejected project invitation', 1, '2020-04-17 05:04:42', '2020-04-21 13:42:11'),
(38, 4, 34, 1, 39, '5E9985444 client has sent project invitation', 0, '2020-04-17 10:44:00', '2020-04-17 10:44:00'),
(39, 29, 34, 1, 39, '5E9985444 client has sent project invitation', 0, '2020-04-17 10:44:00', '2020-04-17 10:44:00'),
(40, 33, 34, 1, 39, '5E9985444 client has sent project invitation', 0, '2020-04-17 10:44:00', '2020-04-17 10:44:00'),
(41, 4, 10, 1, 40, '5E7C4B6387A54 client has sent project invitation', 0, '2020-04-17 12:32:27', '2020-04-17 12:32:27'),
(42, 29, 10, 1, 40, '5E7C4B6387A54 client has sent project invitation', 0, '2020-04-17 12:32:27', '2020-04-17 12:32:27'),
(43, 33, 10, 1, 40, '5E7C4B6387A54 client has sent project invitation', 0, '2020-04-17 12:32:27', '2020-04-17 12:32:27'),
(44, 10, 29, 2, 40, '5E885D11C todder has accepted project invitation', 1, '2020-04-17 12:32:57', '2020-04-17 13:07:05'),
(45, 4, 10, 1, 41, '5E7C4B6387A54 client has sent project invitation', 1, '2020-04-17 12:51:51', '2020-04-21 13:40:21'),
(46, 8, 10, 1, 41, '5E7C4B6387A54 client has sent project invitation', 0, '2020-04-17 12:51:51', '2020-04-17 12:51:51'),
(47, 12, 10, 1, 41, '5E7C4B6387A54 client has sent project invitation', 0, '2020-04-17 12:51:51', '2020-04-17 12:51:51'),
(48, 33, 10, 1, 41, '5E7C4B6387A54 client has sent project invitation', 0, '2020-04-17 12:51:51', '2020-04-17 12:51:51'),
(49, 35, 10, 1, 41, '5E7C4B6387A54 client has sent project invitation', 1, '2020-04-17 12:51:51', '2020-04-24 04:46:12'),
(50, 10, 35, 2, 41, '5E99A5EC0 todder has accepted project invitation', 1, '2020-04-17 12:52:25', '2020-04-17 13:07:08'),
(51, 10, 8, 2, 41, '5E784CF59AC3B todder has accepted project invitation', 1, '2020-04-22 08:41:41', '2020-05-06 10:21:59'),
(52, 8, 10, 1, 42, '5E7C4B6387A54 client has sent project invitation', 0, '2020-04-22 09:57:53', '2020-04-22 09:57:53'),
(53, 10, 8, 2, 42, '5E784CF59AC3B todder has accepted project invitation', 1, '2020-04-22 09:58:15', '2020-05-06 10:22:06'),
(54, 4, 10, 1, 43, '5E7C4B6387A54 client has sent project invitation', 0, '2020-04-22 10:03:19', '2020-04-22 10:03:19'),
(55, 33, 10, 1, 43, '5E7C4B6387A54 client has sent project invitation', 0, '2020-04-22 10:03:19', '2020-04-22 10:03:19'),
(56, 35, 10, 1, 43, '5E7C4B6387A54 client has sent project invitation', 0, '2020-04-22 10:03:19', '2020-04-22 10:03:19'),
(57, 8, 10, 4, 42, '5E7C4B6387A54 client has hired you on test Project 22 April', 0, '2020-04-22 10:18:00', '2020-04-22 10:18:00'),
(58, 8, 10, 1, 44, '5E7C4B6387A54 client has sent project invitation', 0, '2020-04-22 12:26:49', '2020-04-22 12:26:49'),
(59, 10, 8, 2, 44, '5E784CF59AC3B todder has accepted project invitation', 1, '2020-04-22 12:28:47', '2020-05-06 10:29:01'),
(60, 8, 10, 4, 44, '5E7C4B6387A54 client has hired you on Test Project April 22,2020', 0, '2020-04-22 12:34:51', '2020-04-22 12:34:51'),
(61, 36, 1, 5, NULL, 'Congratulation Admin have approved your profile screening', 1, '2020-04-23 10:39:27', '2020-04-24 13:09:47'),
(62, 36, 36, 6, NULL, 'Aptitude test mail sent to your email address.', 0, '2020-04-23 10:39:48', '2020-04-23 10:39:48'),
(63, 36, 36, 7, NULL, 'Congratulation Admin have approved your aptitude test step', 0, '2020-04-23 10:40:42', '2020-04-23 10:40:42'),
(64, 36, 36, 8, NULL, 'Technical test mail sent to your email address.', 0, '2020-04-23 10:40:49', '2020-04-23 10:40:49'),
(65, 36, 36, 9, NULL, 'Congratulation Admin have approved your Technical test step', 1, '2020-04-23 10:40:53', '2020-04-24 13:11:29'),
(66, 36, 36, 9, NULL, 'Congratulation Admin have approved your Technical test step', 0, '2020-04-23 10:40:53', '2020-04-23 10:40:53'),
(67, 36, 36, 10, NULL, 'Congratulation Admin have approved your complete profile', 0, '2020-04-23 10:41:12', '2020-04-23 10:41:12'),
(68, 8, 1, 5, NULL, 'Congratulation Admin have approved your profile screening', 0, '2020-04-23 13:19:39', '2020-04-23 13:19:39'),
(69, 8, 8, 6, NULL, 'Aptitude test mail sent to your email address.', 0, '2020-04-23 13:20:58', '2020-04-23 13:20:58'),
(70, 8, 8, 7, NULL, 'Congratulation Admin have approved your aptitude test step', 0, '2020-04-23 13:26:40', '2020-04-23 13:26:40'),
(71, 35, 35, 5, NULL, 'Congratulation Admin have approved your profile screening', 0, '2020-04-24 04:37:33', '2020-04-24 04:37:33'),
(72, 35, 35, 6, NULL, 'Aptitude test mail sent to your email address.', 0, '2020-04-24 04:37:57', '2020-04-24 04:37:57'),
(73, 35, 35, 7, NULL, 'Congratulation Admin have approved your aptitude test step', 0, '2020-04-24 04:38:10', '2020-04-24 04:38:10'),
(74, 35, 35, 8, NULL, 'Technical test mail sent to your email address.', 0, '2020-04-24 04:38:32', '2020-04-24 04:38:32'),
(75, 35, 35, 9, NULL, 'Congratulation Admin have approved your Technical test step', 0, '2020-04-24 04:39:23', '2020-04-24 04:39:23'),
(76, 35, 35, 10, NULL, 'Congratulation Admin have approved your complete profile', 0, '2020-04-24 04:39:29', '2020-04-24 04:39:29'),
